,author,title,subreddit,num_comments,score,selftext,body,permalink
89,FoxyKellxoxo,,uberdrivers,,0,,So your taking people I can believe that,https://www.reddit.com/r/uberdrivers/comments/hpxzdc/is_everyone_having_good_promos_in_the_their_market/fxvhpgt/
90,FoxyKellxoxo,,uberdrivers,,2,,I made that much in two days on Uber eats ? What state are u in because that’s hard to believe unless your a new driver and your getting lots of bonuses which Uber isn’t doing hardly,https://www.reddit.com/r/uberdrivers/comments/hpxzdc/is_everyone_having_good_promos_in_the_their_market/fxvhnvw/
91,APettyJ,,uberdrivers,,2,,"The federal component of the Pandemic Unemployment Assistance that provides a $600 weekly supplement in addition to whatever state unemployment a person is collecting, is set to stop after the week of July 18th. Right now many drivers are collecting more via unemployment assistance than they would earn risking it by driving during the pandemic. If that weekly $600 payment is not extended in one form or another, many drivers will be forced to return to work, although some may just ride it out with the state unemployment alone, which could last until December.

Once a large amount of drivers who are collecting return to the workforce, it will drive down the surge as well as the frequency of trips offered; much less ping stacking, especially considering that rider demand is still pretty significantly down, although it is rising from its nadir of the pandemic. This is coupled with the fact that Summer tends to be dead in many markets, anyway.

Here's hoping the government gives most of those drivers a reason to stay home by extending the Fed component, if not at $600 then at something not far off, like $400.",https://www.reddit.com/r/uberdrivers/comments/hpxzdc/is_everyone_having_good_promos_in_the_their_market/fxv5rbn/
92,MiaMH20,,uberdrivers,,1,,What do you mean couple weeks left?,https://www.reddit.com/r/uberdrivers/comments/hpxzdc/is_everyone_having_good_promos_in_the_their_market/fxv0x03/
93,wellington28,,uberdrivers,,2,,"Yeah, only a couple weeks left.  Get it while you can.",https://www.reddit.com/r/uberdrivers/comments/hpxzdc/is_everyone_having_good_promos_in_the_their_market/fxv00t0/
94,sweaty_ken,,uberdrivers,,1,,Same.,https://www.reddit.com/r/uberdrivers/comments/hpxzdc/is_everyone_having_good_promos_in_the_their_market/fxusn90/
95,DummyEastOakland,,uberdrivers,,2,,"Although somewhat controversial, I am enjoying the driver pass promo in San Diego. I purchased 100 trip offers at 0% commission for 50 bucks. I especially enjoy setting my own surge multiplier. All it takes is one decent ride and your up $40 - $60 usd.",https://www.reddit.com/r/uberdrivers/comments/hpxzdc/is_everyone_having_good_promos_in_the_their_market/fxuqb6e/
96,pantene2inone,,uberdrivers,,1,,Haven't had a promo since last year,https://www.reddit.com/r/uberdrivers/comments/hpxzdc/is_everyone_having_good_promos_in_the_their_market/fxuoizh/
97,Extension-Kitchen-22,A bad damage to my car.,uberdrivers,14.0,1,"Hi guys. My car's engine got knocked a couple of weeks ago. And I don't have enough money to get one. I'm a single father, and this is the only way I can provide for my daughter. I've ran out of money and I'm struggling to put food on the table. I'm so sad, I don't know what to do.",,https://www.reddit.com/r/uberdrivers/comments/i9e8b1/a_bad_damage_to_my_car/
98,amazinghl,,uberdrivers,,1,,Delivery by bike or motorbike is an option.,https://www.reddit.com/r/uberdrivers/comments/i9e8b1/a_bad_damage_to_my_car/g1h2d48/
99,ifeelthesame4u,,uberdrivers,,1,,What country are you talking about ?,https://www.reddit.com/r/uberdrivers/comments/i9e8b1/a_bad_damage_to_my_car/g1fx03z/
100,dswain16,,uberdrivers,,1,,"If you know how to hotwire, you could borrow one while you earn some money then put it back.",https://www.reddit.com/r/uberdrivers/comments/i9e8b1/a_bad_damage_to_my_car/g1fr36i/
101,PinkPropaganda,,uberdrivers,,1,,It’s an option in many Latin American countries.,https://www.reddit.com/r/uberdrivers/comments/i9e8b1/a_bad_damage_to_my_car/g1en4b6/
102,SFUber,,uberdrivers,,1,,Well you might get better tailored advice if you told us what country you are in.,https://www.reddit.com/r/uberdrivers/comments/i9e8b1/a_bad_damage_to_my_car/g1emzqb/
103,joshwashere,,uberdrivers,,1,,Maybe get a regular job close to home???,https://www.reddit.com/r/uberdrivers/comments/i9e8b1/a_bad_damage_to_my_car/g1em4z3/
104,dash2731,,uberdrivers,,1,,You can check online to see if people are renting out their cars to Uber drivers,https://www.reddit.com/r/uberdrivers/comments/i9e8b1/a_bad_damage_to_my_car/g1ek8ob/
105,Extension-Kitchen-22,,uberdrivers,,1,,No option for me like that in my country,https://www.reddit.com/r/uberdrivers/comments/i9e8b1/a_bad_damage_to_my_car/g1ejyn2/
106,Extension-Kitchen-22,,uberdrivers,,1,,Thank you so much,https://www.reddit.com/r/uberdrivers/comments/i9e8b1/a_bad_damage_to_my_car/g1ejv8p/
107,Extension-Kitchen-22,,uberdrivers,,1,,We don't have that option in my country. I'm not from the US,https://www.reddit.com/r/uberdrivers/comments/i9e8b1/a_bad_damage_to_my_car/g1ejume/
108,KINGspace33,,uberdrivers,,1,,Also check for rental options in your area. Might run you about $250 for the week but if you grind it’s an option for right now.,https://www.reddit.com/r/uberdrivers/comments/i9e8b1/a_bad_damage_to_my_car/g1ejnr9/
109,naffhouse,,uberdrivers,,3,,Sorry to hear this bad news. Good luck to you.,https://www.reddit.com/r/uberdrivers/comments/i9e8b1/a_bad_damage_to_my_car/g1ejhts/
110,dash2731,,uberdrivers,,1,,Yep I second this. Get a moped or an ebike and start doing deliveries in a city. You can make good money to start saving up,https://www.reddit.com/r/uberdrivers/comments/i9e8b1/a_bad_damage_to_my_car/g1ejc85/
111,PinkPropaganda,,uberdrivers,,1,,"Fuck man. Get a scooter if possible and do Uber Eats, DoorDash, Postmates and Grubhub. Look for other jobs in the downtime. Life is hard.",https://www.reddit.com/r/uberdrivers/comments/i9e8b1/a_bad_damage_to_my_car/g1eizmg/
112,GifHerSomeJr,No quest in California,uberdrivers,18.0,1,Looks like the last week there won’t be a quest fam. Much love out there! I loved this side gig and at 25-30 an hour it’s going to be sad to leave. Now I’m just going to be driving my two sisters to work everyday bc they used Uber to get to and from. This will be interesting,,https://www.reddit.com/r/uberdrivers/comments/iauhdq/no_quest_in_california/
113,uberShareCropper,,uberdrivers,,1,,Little bish,https://www.reddit.com/r/uberdrivers/comments/iauhdq/no_quest_in_california/g231fep/
114,americanexpatriate,,uberdrivers,,1,,side gig times 25. You ain't getting more than a buck for my cock in your mouth,https://www.reddit.com/r/uberdrivers/comments/iauhdq/no_quest_in_california/g231dqb/
115,angerymonkey,,uberdrivers,,1,,But...but.. this is the 5th largest economy!,https://www.reddit.com/r/uberdrivers/comments/iauhdq/no_quest_in_california/g1tq587/
116,One-eyed-snake,,uberdrivers,,1,,"Yeah.  Glad you realize what it really is now. Vote how ever you want but know what you are voting for or against 

A yes = drivers for for Luber (uber,lyft  and etc) could be still marked as IC, regardless of AB5.  So Luber could continue on with today’s format.Skirting laws by technicality like they’ve done for a decade. 

no= Luber must comply with an already passed law.  They have to pay a min wage based on location and reimburse for expenses incurred. It’s Luber’s choice to use the mileage or actual method.  Not the driver’s choice. 

But here’s where it gets wonky.  Even as employees in calif most of the bennies don’t kick in til 31+ hours.  So would Luber allow 32+hours? Not likely. 

Either way.  Yes= ic. No = employee",https://www.reddit.com/r/uberdrivers/comments/iauhdq/no_quest_in_california/g1ssd23/
117,SpiderWil,,uberdrivers,,1,,"I just read this Prop and it's so confusing. I thought initially Prop 22 was created by the state to make Uber define app-based riders as employees. But now after I read it many times, voting no actually means to do just that.",https://www.reddit.com/r/uberdrivers/comments/iauhdq/no_quest_in_california/g1spdkx/
118,SpiderWil,,uberdrivers,,1,,Uber drivers need to understand that they can't have it both ways. They can't expect Uber to give in and treat them like employees while at the same time expect this greedy money thirsty unapologetic unempathetic gargantuan conglomerate to not fight back. Either suck up to Uber and work as a slave. Or fight them back by not having no job for 2 months and vote NO to NOT PASS Prop 22. Omg the wording is so confusing. No this prop is more likely to be passed than to be defeated.,https://www.reddit.com/r/uberdrivers/comments/iauhdq/no_quest_in_california/g1sof5g/
119,Damean1,,uberdrivers,,1,,No they won't. Companies do not remain in markets where they lose money.,https://www.reddit.com/r/uberdrivers/comments/iauhdq/no_quest_in_california/g1skp0n/
120,thisanneslife,,uberdrivers,,1,,I've been averaging this lately as well.,https://www.reddit.com/r/uberdrivers/comments/iauhdq/no_quest_in_california/g1scsvr/
121,Slinky621,,uberdrivers,,1,,Will your sisters pay you or will they just use you because you're family? Lol,https://www.reddit.com/r/uberdrivers/comments/iauhdq/no_quest_in_california/g1rxmsd/
122,One-eyed-snake,,uberdrivers,,1,,"Don’t bet on it. Rides are still subsidized by vc money. Less rides = less profit loss. 

They miss out on revenue to fuck around with but that’s it",https://www.reddit.com/r/uberdrivers/comments/iauhdq/no_quest_in_california/g1rw7od/
123,One-eyed-snake,,uberdrivers,,2,,"This whole ab5 thing isn’t about workers rights.  It’s about money the state wants.  And it doesn’t much matter how uber tries to change people into “contractors” because they can’t pass part b of the abc test. 

Prop 22 is going to lose by a landslide too.  The way the state worded the description will make any sensible person that isn’t a driver or family member vote no.",https://www.reddit.com/r/uberdrivers/comments/iauhdq/no_quest_in_california/g1rvs7h/
124,angerymonkey,,uberdrivers,,1,,This the funniest joke I've heard all month!,https://www.reddit.com/r/uberdrivers/comments/iauhdq/no_quest_in_california/g1rupe5/
125,the-tru-albertan,,uberdrivers,,2,,"Exactly. If there was ever a time to pull the plug, it’s now.",https://www.reddit.com/r/uberdrivers/comments/iauhdq/no_quest_in_california/g1rsp5d/
126,Offduty_shill,,uberdrivers,,1,,"As a rider I'm conflicted on this.

I want these companies to treat drivers fairly but I also don't want them to be eliminated...what do drivers think about prop 22/contractor status? Will Uber/Lyft just be out of California if this prop does not pass?

I imagine as a side gig many might not mind being contractors and enjoy the flexible hours...but if you're driving as a main job it might suck?",https://www.reddit.com/r/uberdrivers/comments/iauhdq/no_quest_in_california/g1rpqpm/
127,GifHerSomeJr,,uberdrivers,,1,,Yes I have a main job and do this on the side. Average 25-30 on weekends,https://www.reddit.com/r/uberdrivers/comments/iauhdq/no_quest_in_california/g1rou70/
128,uberShareCropper,,uberdrivers,,1,,25-30 hour is a side gig ?,https://www.reddit.com/r/uberdrivers/comments/iauhdq/no_quest_in_california/g1roj7f/
129,BigbyWolf8,,uberdrivers,,1,,"They won't come back before November - California has been hit hard by COVID, so they are getting no revenue and profits from it right now.  It makes sense for them to shut down for a few months, everyone will be pissed at the inept government, and then see if Prop 22 passes.",https://www.reddit.com/r/uberdrivers/comments/iauhdq/no_quest_in_california/g1ro30c/
130,LARental,,uberdrivers,,2,,Uber and Lyft will lose so much money from not providing service to California that they will give in and make you all employees.,https://www.reddit.com/r/uberdrivers/comments/iauhdq/no_quest_in_california/g1rk76n/
131,DruidTrixxx,Morons Want to be Employees,uberdrivers,21.0,1,They are going to ruin a good thing. Sad.,,https://www.reddit.com/r/uberdrivers/comments/ic9okf/morons_want_to_be_employees/
132,ZealousidealChannel4,,uberdrivers,,1,,It’ll help spread the word about your business. Or get USPS to do it. They straight up deliver to every mailbox for a fee.,https://www.reddit.com/r/uberdrivers/comments/ic9okf/morons_want_to_be_employees/g23f3kf/
133,Successful-Luck,,uberdrivers,,1,,"Yea, you go and do that. Your door-to-door strategy is going give you enough rides yea?",https://www.reddit.com/r/uberdrivers/comments/ic9okf/morons_want_to_be_employees/g22sjzy/
134,ZealousidealChannel4,,uberdrivers,,2,,Don’t fret small beginnings,https://www.reddit.com/r/uberdrivers/comments/ic9okf/morons_want_to_be_employees/g22nhfj/
135,DruidTrixxx,,uberdrivers,,0,,Yup,https://www.reddit.com/r/uberdrivers/comments/ic9okf/morons_want_to_be_employees/g22h2ww/
136,clementine16,,uberdrivers,,1,,I hate these shitheads. They going to kill the ridesharing industry in California. Fucktards!,https://www.reddit.com/r/uberdrivers/comments/ic9okf/morons_want_to_be_employees/g22gv7h/
137,DruidTrixxx,,uberdrivers,,4,,They will find out. And use their own cars still too😂😂😂,https://www.reddit.com/r/uberdrivers/comments/ic9okf/morons_want_to_be_employees/g21nwut/
138,kwakcheese,,uberdrivers,,4,,"Sounds like you Ubers who hate working for Uber never worked for minimum wage, not least, minimum wage with a fucking boss.",https://www.reddit.com/r/uberdrivers/comments/ic9okf/morons_want_to_be_employees/g21nour/
139,angerymonkey,,uberdrivers,,4,,Why not just stand on a corner with a sandwich board?,https://www.reddit.com/r/uberdrivers/comments/ic9okf/morons_want_to_be_employees/g21mzmp/
140,ZealousidealChannel4,,uberdrivers,,0,,"Start your own ride share business. Advertise it, make a schedule visible, go door to door handing out business cards. You’re the alternative.",https://www.reddit.com/r/uberdrivers/comments/ic9okf/morons_want_to_be_employees/g21jgz8/
141,Successful-Luck,,uberdrivers,,2,,Still another job.,https://www.reddit.com/r/uberdrivers/comments/ic9okf/morons_want_to_be_employees/g21ik1k/
142,ZealousidealChannel4,,uberdrivers,,2,,Getting a better job.,https://www.reddit.com/r/uberdrivers/comments/ic9okf/morons_want_to_be_employees/g21ifje/
143,DruidTrixxx,,uberdrivers,,2,,Not in LA mate. I know people who drive there. Its brutal.,https://www.reddit.com/r/uberdrivers/comments/ic9okf/morons_want_to_be_employees/g21hydx/
144,HollywoodMate,,uberdrivers,,0,,Where do you live,https://www.reddit.com/r/uberdrivers/comments/ic9okf/morons_want_to_be_employees/g21hfrl/
145,DruidTrixxx,,uberdrivers,,2,,They didnt. My tips are amazing. If not for tips I would not drive at all even before the new pay. I get 10$ tips every day. And 20$ tips at least a few times a week. The tips are picking up the slack.,https://www.reddit.com/r/uberdrivers/comments/ic9okf/morons_want_to_be_employees/g21h5hh/
146,Facts_About_Cats,,uberdrivers,,1,,Why would your tips go down?,https://www.reddit.com/r/uberdrivers/comments/ic9okf/morons_want_to_be_employees/g21g7wx/
147,DruidTrixxx,,uberdrivers,,1,,And? I was making 40-50 ph before the new pay. It cut in half. More than half my pay comes from tips. Sometimes like 75%. I still dont want to be an employee that has to work a specific shift I am assigned to. I like being able to turn my app on ehen I want to.,https://www.reddit.com/r/uberdrivers/comments/ic9okf/morons_want_to_be_employees/g21d86l/
148,HollywoodMate,,uberdrivers,,1,,"This is guy who said what 


https://reddit.com/r/uberdrivers/comments/hn1cvn/_/fxn5466/?context=1",https://www.reddit.com/r/uberdrivers/comments/ic9okf/morons_want_to_be_employees/g21cieq/
149,Successful-Luck,,uberdrivers,,1,,What's the alternative other than getting another job?,https://www.reddit.com/r/uberdrivers/comments/ic9okf/morons_want_to_be_employees/g21cggw/
150,naffhouse,,uberdrivers,,3,,"Gotta love it.

It’s back firing on them big time.

They are learning a tough lesson about capitalism.

Those who own the capital decide everything.",https://www.reddit.com/r/uberdrivers/comments/ic9okf/morons_want_to_be_employees/g219e6s/
151,FishingInPotholes,,uberdrivers,,2,,"Morons think driving fro uber is a ""good thing"".",https://www.reddit.com/r/uberdrivers/comments/ic9okf/morons_want_to_be_employees/g218waw/
152,nurillo97,,uberdrivers,,1,,Yes fucking morons,https://www.reddit.com/r/uberdrivers/comments/ic9okf/morons_want_to_be_employees/g217vae/
153,Sallyman40,"Congratulations, you played yourself",uberdrivers,27.0,1,"Squad of 5 pull up to my car for a 3 minute ride from downtown to the university area (approx $4-5, I drive in Canada)

Me: sorry guys I can only take 3

Pax1: really?!

Me: yeah sorry

Pax2: the last Uber driver didn’t care?

Me: yeah sorry I’m not risking the fine for a few bucks

Pax1: we’ll just hop in the trunk

Me: Na that’s not happening

Pax3: wow that’s pretty sad

Pax2: whatever just cancel the ride you’re losing money

Me: sounds good

*I can hear them cursing outside the car, probably at me*
*cancels ride due too many riders*
*collect $4.40 cancellation fee from customer*",,https://www.reddit.com/r/uberdrivers/comments/isqtzt/congratulations_you_played_yourself/
154,sweaty_ken,,uberdrivers,,1,,Savage.,https://www.reddit.com/r/uberdrivers/comments/isqtzt/congratulations_you_played_yourself/g5bm4uf/
155,Magician_322,,uberdrivers,,3,,Dude was pissed. Was a drunk who didn't want to wear a mask.  I even offered him one.  Kept my doors locked and waited a couple mins to text my standard greeting.  The last time he canceled but was to late.  I once got someone a cancel fee on uber so they tried using lyft got me and got it again,https://www.reddit.com/r/uberdrivers/comments/isqtzt/congratulations_you_played_yourself/g5axlko/
156,Sustained10k,,uberdrivers,,8,,"&gt;You mad bro?

Well he's an uber driver so yes.",https://www.reddit.com/r/uberdrivers/comments/isqtzt/congratulations_you_played_yourself/g5axbqa/
157,Sustained10k,,uberdrivers,,0,,How did you not get assaulted? Lmao must have been funny asf tho,https://www.reddit.com/r/uberdrivers/comments/isqtzt/congratulations_you_played_yourself/g5ax8ck/
158,Sallyman40,,uberdrivers,,1,,That kinda sucks,https://www.reddit.com/r/uberdrivers/comments/isqtzt/congratulations_you_played_yourself/g5atbzm/
159,inlarry,,uberdrivers,,2,,"Right, I'm just saying that here we don't get that option - it's wait 5 minutes and get a fee, or leave before and you made a trip there for free. It's rather annoying.",https://www.reddit.com/r/uberdrivers/comments/isqtzt/congratulations_you_played_yourself/g5aq4by/
160,Sallyman40,,uberdrivers,,1,,"No masks, no car seat, too many passengers you can instantly get a cancellation fee. 

They usually don’t complain about it, well at least I don’t hear about it.

It’s not like I let them know there’s a cancellation fee, I just cancel, drive away and collect my fee",https://www.reddit.com/r/uberdrivers/comments/isqtzt/congratulations_you_played_yourself/g5afv32/
161,Sallyman40,,uberdrivers,,1,,"Yeah most time that’s the case. In this instance, pax pinged me, less than a minute later I see a group of 5 down the street start approaching my vehicle. This is was an outdoor/patio if that makes it easier to believe",https://www.reddit.com/r/uberdrivers/comments/isqtzt/congratulations_you_played_yourself/g5afk1c/
162,inlarry,,uberdrivers,,0,,"Must be nice. I mean I get that ""no show"" needs some amount of wait, but things like no mask, too many people, no car seat, should be no questions asked + fee charged. But, you Canucks are a lot less Karen-y than we down south so overall it's probably less likely that you have issues with customers complaining about it.",https://www.reddit.com/r/uberdrivers/comments/isqtzt/congratulations_you_played_yourself/g5aev4u/
163,FishingInPotholes,,uberdrivers,,1,,"Your assertion is that the ping came in and you accepted it and the pax was at your car IMMEDIATELY.  Do I have that correct?  

You lost everyone at ""guy in bar orders uber and is ready to leave"".  We all know the way it works is ""guy orders uber from inside bar, uber arrives, guy finishes his drink, pays the tab, uber driver sends message telling drunk fuck to get his ass out there, pax says goodbye to all of his 'friends', searches for the door, stumbles out, and bitches because the driver was gone 10 mins ago"".",https://www.reddit.com/r/uberdrivers/comments/isqtzt/congratulations_you_played_yourself/g5aetjn/
164,kaimonst3r,,uberdrivers,,1,,Ok captain,https://www.reddit.com/r/uberdrivers/comments/isqtzt/congratulations_you_played_yourself/g5adydp/
165,Sallyman40,,uberdrivers,,1,,"Millions of uber drivers who’ve completed millions of combined trips together and this is something that would never happen?

Who pissed in your cereal this morning good sir?",https://www.reddit.com/r/uberdrivers/comments/isqtzt/congratulations_you_played_yourself/g5adifv/
166,FishingInPotholes,,uberdrivers,,-1,,"0 seconds.  Ping comes in and pax immediately appears at your door.  Cool story bro, although a huge fucking lie.  We drive for Uber, we know better than the shit your spewing.",https://www.reddit.com/r/uberdrivers/comments/isqtzt/congratulations_you_played_yourself/g5acu6l/
167,Sallyman40,,uberdrivers,,3,,I think your right,https://www.reddit.com/r/uberdrivers/comments/isqtzt/congratulations_you_played_yourself/g5acho5/
168,Sallyman40,,uberdrivers,,2,,"Hmmmm when you park you car outside a bar. Your most likely to get a ping from a person leaving that bar. So your right it wasn’t 10 seconds. It was 0 seconds. I was already there. 

Why so mad bro?",https://www.reddit.com/r/uberdrivers/comments/isqtzt/congratulations_you_played_yourself/g5acbtk/
169,Sallyman40,,uberdrivers,,-3,,"Look up the rules and regulation of Uber Canada, I can pull up in 10 seconds and cancel and get a fee. Don’t be salty you sad American 😎",https://www.reddit.com/r/uberdrivers/comments/isqtzt/congratulations_you_played_yourself/g5ac4ms/
170,FishingInPotholes,,uberdrivers,,-2,,Plot twist -- I don't ride in Covid-infested pissbuckets.,https://www.reddit.com/r/uberdrivers/comments/isqtzt/congratulations_you_played_yourself/g5ac3js/
171,kaimonst3r,,uberdrivers,,3,,Plot twist. This is guy who ordered the Uber ride and is salty that you got his money.,https://www.reddit.com/r/uberdrivers/comments/isqtzt/congratulations_you_played_yourself/g5aa58u/
172,Magician_322,,uberdrivers,,2,,Best i have had is a 3 in a row,https://www.reddit.com/r/uberdrivers/comments/isqtzt/congratulations_you_played_yourself/g5a1ntx/
173,fitfulbrain,,uberdrivers,,1,,"I canceled for ""too many riders"" once. I pulled over in front of a bar or something but nobody came forward. There are too many riders waiting for their rides and I couldn't ask all of them if they are waiting for me. So I bailed for too many of them, LOL.",https://www.reddit.com/r/uberdrivers/comments/isqtzt/congratulations_you_played_yourself/g59zi57/
174,inlarry,,uberdrivers,,1,,"Where do you live that at 1 minute wait you get paid for ANYTHING. It doesn't matter what the reason is here, if it's not 5+ minutes, no fee.",https://www.reddit.com/r/uberdrivers/comments/isqtzt/congratulations_you_played_yourself/g59wmfg/
175,FishingInPotholes,,uberdrivers,,-5,,10 seconds to pull up... bullshit.   5 seconds to collect the cancellation fee... bullshit.  You wasted your time and mine by creating this smug bullshit post.,https://www.reddit.com/r/uberdrivers/comments/isqtzt/congratulations_you_played_yourself/g59vsiu/
176,Sallyman40,,uberdrivers,,10,,"Jokes on you. I was already at the location when the ping came in. Took me 10 seconds to pull up to the location, 40 seconds to argue with them. 5 seconds to collect my cancellation fee.

You mad bro?",https://www.reddit.com/r/uberdrivers/comments/isqtzt/congratulations_you_played_yourself/g59tr93/
177,FishingInPotholes,,uberdrivers,,-11,,"Congratulations on driving to their location, arguing with them, wasting your time, collecting the earth-shattering sum of $4.40 and coming on here to brag about it.  You clearly didn't play yourself.  LOL",https://www.reddit.com/r/uberdrivers/comments/isqtzt/congratulations_you_played_yourself/g59s66q/
178,Maddhouse15,,uberdrivers,,-8,,Put a quarter in your ass cause you played yourself,https://www.reddit.com/r/uberdrivers/comments/isqtzt/congratulations_you_played_yourself/g59ronk/
179,Sallyman40,,uberdrivers,,3,,Oh man I wish,https://www.reddit.com/r/uberdrivers/comments/isqtzt/congratulations_you_played_yourself/g59naam/
180,Hagong,,uberdrivers,,4,,"Did you get their ping again, for another easy cancel fee?",https://www.reddit.com/r/uberdrivers/comments/isqtzt/congratulations_you_played_yourself/g59l2ld/
