,author,title,subreddit,num_comments,score,selftext,body,permalink
181,pilgrim_dragon_green,Should I down rate them?,uberdrivers,27.0,1,"So, I am confused about what my Uber passengers can or can't see.  My issue is this, should I down rate anyone who I don't really want again, so I don't get them?  Or can they see that I've done it and revenge vote me down too?

My rating just keeps dropping, and I'm frustrated.  I get it if I'm really cranky, but today I think I was fine, friendly, drove normally, and didn't bother anyone.  I'm guessing that it might be the 40-something professional male tourist who seemed to expect me to be his entertainment-tour guide-maybe prostitute, talking in a weird jocose too friendly voice who I kind of politely froze out, or possibly the junkie girl who maybe thought I was flirting with her junkie boyfriend because I was making polite conversation, or the incredibly inappropriate sex jokes sales people tourist might have been angry because I might the 3 of them sit in the back seat.  Or maybe the guy who left me waiting the full 3 + 3 minutes on his driveway, during which time I saw his 4.4 rating, and cancelled, I don't know if he got a vote.  I mean... wtf some of this.  I blame the first two maybe down rates on making an effort to look better today, not wanting to be a sad Uber driver, guess you can't win for trying...",,https://www.reddit.com/r/uberdrivers/comments/iu7kov/should_i_down_rate_them/
182,MichaelofOrange,,uberdrivers,,1,,"Don’t kid yourself: acceptance rate is a stat trap that only benefits L/Uber. The stupid “rewards” tied to it are garbage, anyway.",https://www.reddit.com/r/uberdrivers/comments/iu7kov/should_i_down_rate_them/g5yg7vw/
183,Echelion77,,uberdrivers,,1,,"As a professional rider, dont talk to me, if you have water ill probably shoot you a tip orherwise get me there safely learn throttle and break control as in if I feel my body being pushed forward your breaking to hard or if you gas up to fast i cancel the trip and wait for a new driver, do all this and you'll be back to 4.9 in no time. 

Currently a 4.97 rider and maintaining. This isent a contact service industry.",https://www.reddit.com/r/uberdrivers/comments/iu7kov/should_i_down_rate_them/g5nfiam/
184,[deleted],,uberdrivers,,1,,[deleted],https://www.reddit.com/r/uberdrivers/comments/iu7kov/should_i_down_rate_them/g5nehny/
185,One-eyed-snake,,uberdrivers,,1,,"I’m not offended. You’re just sick, and also apparently offended because I said handjob. Perhaps you should read that comment again. I agreed with you and I guess you think I don’t want a handjob from you. I don’t, but that was me talking to the try hards. Not you. 
Read it again. Lmao",https://www.reddit.com/r/uberdrivers/comments/iu7kov/should_i_down_rate_them/g5ndrtj/
186,[deleted],,uberdrivers,,1,,[deleted],https://www.reddit.com/r/uberdrivers/comments/iu7kov/should_i_down_rate_them/g5n5uq9/
187,One-eyed-snake,,uberdrivers,,1,,"Yeah. I defend uber.  Lmao. You’re hilarious. 

And the sick sexual comments about a minor takes the cake.",https://www.reddit.com/r/uberdrivers/comments/iu7kov/should_i_down_rate_them/g5n4isv/
188,[deleted],,uberdrivers,,1,,[deleted],https://www.reddit.com/r/uberdrivers/comments/iu7kov/should_i_down_rate_them/g5n3bsw/
189,One-eyed-snake,,uberdrivers,,1,,"Seems to me you’re the one with the childish name calling thing going on.  Anyone who doesn’t fully agree with you is a a hick and a shill?  Whatever. Perhaps one day you’ll realize not everyone thinks like you.  

Not to mention attacks on family members that are sexual.  It’s disgusting",https://www.reddit.com/r/uberdrivers/comments/iu7kov/should_i_down_rate_them/g5n2fq1/
190,noPROP22,,uberdrivers,,1,,"No you should go look at your post history and see the asinine disrespectful comments you make, shows how big of a uneducated intolerant hick you are .",https://www.reddit.com/r/uberdrivers/comments/iu7kov/should_i_down_rate_them/g5meuoh/
191,One-eyed-snake,,uberdrivers,,1,,"“Maybe you’re daughter is giving out hand jobs to random Uber drivers .

You should know how to act and behave in a public forum so others treat you with sanity .”

So you’re insane?  Ok, if you say so.  That explains a lot.",https://www.reddit.com/r/uberdrivers/comments/iu7kov/should_i_down_rate_them/g5mdkx4/
192,noPROP22,,uberdrivers,,1,,"Maybe you’re daughter is giving out hand jobs to random Uber drivers . 


You should know how to act and behave in a public forum so others treat you with sanity .",https://www.reddit.com/r/uberdrivers/comments/iu7kov/should_i_down_rate_them/g5mcxva/
193,One-eyed-snake,,uberdrivers,,1,,"“Your daughter is checking it right now”
Something is seriously wrong with you.",https://www.reddit.com/r/uberdrivers/comments/iu7kov/should_i_down_rate_them/g5mbxoy/
194,noPROP22,,uberdrivers,,1,,Your daughter is checking it right now .,https://www.reddit.com/r/uberdrivers/comments/iu7kov/should_i_down_rate_them/g5mbddq/
195,One-eyed-snake,,uberdrivers,,1,,Ha. Hardly. But you can believe whatever you want.  You should get that anger checked out. It’s not healthy,https://www.reddit.com/r/uberdrivers/comments/iu7kov/should_i_down_rate_them/g5mai1t/
196,noPROP22,,uberdrivers,,0,,You’re an apologist for Dara.  Go fuck yourself.,https://www.reddit.com/r/uberdrivers/comments/iu7kov/should_i_down_rate_them/g5m8j4z/
197,One-eyed-snake,,uberdrivers,,1,,"

Damn. You’re disgruntled huh? You butthurt about me saying I don’t like ass kissers?  Did that hit home or something?  

Still waiting for my shill paycheck.",https://www.reddit.com/r/uberdrivers/comments/iu7kov/should_i_down_rate_them/g5m7cse/
198,noPROP22,,uberdrivers,,1,,"You get so bent with anything negative about Uber , you are a shill . You should do a little drivers appreciation and go around town sucking all the platinum and diamond drivers . 
I ain’t no ignorant hick like yourself , I will be okay without Uber .",https://www.reddit.com/r/uberdrivers/comments/iu7kov/should_i_down_rate_them/g5m1yms/
199,One-eyed-snake,,uberdrivers,,1,,"Shills get paid and I want my shill paycheck.  Where is it?

E. I know what’s wrong with you.  You’re worried about not making minimum wage soon.  Don’t worry.  You’ll be a part time uber employee soon enough",https://www.reddit.com/r/uberdrivers/comments/iu7kov/should_i_down_rate_them/g5lzpwa/
200,noPROP22,,uberdrivers,,1,,Keep licking the boot .,https://www.reddit.com/r/uberdrivers/comments/iu7kov/should_i_down_rate_them/g5lx6q7/
201,One-eyed-snake,,uberdrivers,,4,,"Cancels can’t rate you. 

Yes, they can retaliate if you give them 1*,  but it doesn’t happen that often. It would have to be someone that cares about their rating and they’d have to pay attention to it.  

Simply rating them 1* doesn’t unmatch you from them like lyft. You have to message support for that. If you select a reason for the 1* a rep might actually see it (or the algo) and possibly unmatch you  but you’ll get a message stating so.  

Selecting a reason will also send a message to the paxhole reminding them of “community guidelines” which will definitely make them notice their rating drop. So keep that in mind.    I rate accordingly and don’t select a reason. If they notice it and give me a 1* back, oh well.   Sometimes you’ll know for a fact you’re trading 1* as you’re doing it.",https://www.reddit.com/r/uberdrivers/comments/iu7kov/should_i_down_rate_them/g5jylpe/
202,One-eyed-snake,,uberdrivers,,4,,"Very true. When I’m the paxhole I absolutely hate the “try hards”.  It’s annoying as all fuck.   
I don’t want your water or mints. I don’t gaf what route you take, and I’ll pass on the handjob. Just shut up and drive",https://www.reddit.com/r/uberdrivers/comments/iu7kov/should_i_down_rate_them/g5jxhs3/
203,pilgrim_dragon_green,,uberdrivers,,1,,"I know you’re right.  I’ve been anxious to keep funds and acceptance up and generally try to be accepting but.... screw that, if I’m going to get back to a good level I need to get good pax.",https://www.reddit.com/r/uberdrivers/comments/iu7kov/should_i_down_rate_them/g5jnnyi/
204,Hagong,,uberdrivers,,2,,"Don’t pickup low-rated pax if you’re really concerned about your ratings. 4.8 below, no go.",https://www.reddit.com/r/uberdrivers/comments/iu7kov/should_i_down_rate_them/g5jahj4/
205,pilgrim_dragon_green,,uberdrivers,,0,,"Oh wow, super useful advice, bro.  I'll tip you in the app for it!",https://www.reddit.com/r/uberdrivers/comments/iu7kov/should_i_down_rate_them/g5j2bzw/
206,pilgrim_dragon_green,,uberdrivers,,2,,"I think you're right.  I've definitely noticed that.  But today I wasn't really kissing ass at all, or being particularly rude, and yet they still downrated me.  Meh.  I guess it can just be fickle.  I feel like I get individual pax that are really great, and a lot that are fine, but all it takes is a couple whiners who don't punch 5 to ruin the rating.  Grr.",https://www.reddit.com/r/uberdrivers/comments/iu7kov/should_i_down_rate_them/g5j1602/
207,noPROP22,,uberdrivers,,4,,"Drive like you don’t give a shit , kiss ass too much you will be downrated.",https://www.reddit.com/r/uberdrivers/comments/iu7kov/should_i_down_rate_them/g5j0rx1/
208,PinkPropaganda,,uberdrivers,,2,,"If it keeps dropping you’re losing your chill. Plenty of drivers have a high rating, keeping the money flowing to Dara. You have a low rating. Less money is flowing to Dara. Maybe you aren’t fit for the job.",https://www.reddit.com/r/uberdrivers/comments/iu7kov/should_i_down_rate_them/g5j09ir/
209,rose64bit,Does Anybody Else See This? Always gets me sad because there never are any snacks. I’m stuck at gold with a 94% satisfaction so could that be why i don’t get snacks?,uberdrivers,0.0,1,,,https://www.reddit.com/r/uberdrivers/comments/j1piki/does_anybody_else_see_this_always_gets_me_sad/
210,wolfywill,What’s at stake,uberdrivers,14.0,1,"This is not asking people to vote yes or no. Everyone should do their own research before deciding how to vote. 
However, one must acknowledge that Uber’s attempt to scare drivers out AB5 is beyond pathetic. 
It’s very sad that they are going all these lengths when all they have to do was pay a little higher rate.",,https://www.reddit.com/r/uberdrivers/comments/j8w6he/whats_at_stake/
211,SDSUrules,,uberdrivers,,1,,"I started driving in feb (great timing I know) to make a few hundred a week.  

I drive an EV.",https://www.reddit.com/r/uberdrivers/comments/j8w6he/whats_at_stake/g8pzkg7/
212,wolfywill,,uberdrivers,,1,,"I’m not sure if you’re lying coz you want to advocate for prop 22, or you’re just lying to yourself. 
Anyways, I’m glad you are content , good luck boo",https://www.reddit.com/r/uberdrivers/comments/j8w6he/whats_at_stake/g8pxoxb/
213,SDSUrules,,uberdrivers,,1,,Being on the road isn’t expensive....  I’m speaking as a driver.,https://www.reddit.com/r/uberdrivers/comments/j8w6he/whats_at_stake/g8pwvq0/
214,wolfywill,,uberdrivers,,1,,"I never said I’m with AB5. I’m only discussing their campaign and I have no time to keep explaining myself. Drivers should get paid more because if you’ve been on the road for long enough, you’d realize that the expenses of staying on the road are too damn high (gas, brakes, maintenance, oil, depreciation, tires, insurance). When you factor all this, drivers are not even making minimum wage. I hope this answers your concerns! 
AB5 is stupid, but prop 22 is deceiving and disrespectful",https://www.reddit.com/r/uberdrivers/comments/j8w6he/whats_at_stake/g8pwr5n/
215,SDSUrules,,uberdrivers,,1,,"TNCs are not there to benefit their drivers.  They are a business just like any other business like Amazon, Apple, etc.  

Most drivers enjoy the flexibility and do not want to be told when to drive.

The issue is that AB5 was specifically targeted at TNCs and have a ton of exemptions.  I just want consistency.

There were (pre covid) millions of full time, low skill jobs available but people didn’t want them.",https://www.reddit.com/r/uberdrivers/comments/j8w6he/whats_at_stake/g8pt4n3/
216,SDSUrules,,uberdrivers,,1,,"Why should drivers get paid more?  Driving is a pretty basic skill and pay should be inline with the skill set.  

Most drivers are for 22 and against AB5. Being able to choose your hours is more important than an extra few dollars you might get being an employee.",https://www.reddit.com/r/uberdrivers/comments/j8w6he/whats_at_stake/g8psnsl/
217,bigmoney21dealer,,uberdrivers,,1,,Tell me how it’s like to drive for minimum wage,https://www.reddit.com/r/uberdrivers/comments/j8w6he/whats_at_stake/g8k9ma3/
218,GUNNAthaSTUNNA,,uberdrivers,,1,,Tough,https://www.reddit.com/r/uberdrivers/comments/j8w6he/whats_at_stake/g8jw9hp/
219,VictoriaEuphoria99,,uberdrivers,,1,,"At least we aren't UK, they looked up what it meant the day after the election.",https://www.reddit.com/r/uberdrivers/comments/j8w6he/whats_at_stake/g8fy6hq/
220,bigmoney21dealer,,uberdrivers,,0,,"I will literally cost me $50,000 a year of prop 22 doesn’t pass",https://www.reddit.com/r/uberdrivers/comments/j8w6he/whats_at_stake/g8frddr/
221,angerymonkey,,uberdrivers,,1,,"Making drivers employees will cost about $8k per driver per year. That's not a drop in the bucket. There are a lot of people who just drive to earn an extra thousand or so a month (i.e., about $12k/year). They will **NOT** get hired if Prop 22 fails.",https://www.reddit.com/r/uberdrivers/comments/j8w6he/whats_at_stake/g8fo9zc/
222,Bockwai,,uberdrivers,,1,,"So based on that very valid observation and the fact that these TNCs have never done anything of substance to increase their horde's earnings (outside of rare and ridic promotions), wtf would you vote yes on 22?  Based on their track record of Fing their mules at every opportunity, what makes any mule think that prop 22 will make them better off?  Aside from those who would not be eligible to work as an employee in CA.",https://www.reddit.com/r/uberdrivers/comments/j8w6he/whats_at_stake/g8f75po/
223,FishingInPotholes,,uberdrivers,,3,,"""I'm not going to tell you how to vote, but then I'll make statements suggesting that you should vote against it.""",https://www.reddit.com/r/uberdrivers/comments/j8w6he/whats_at_stake/g8exqz9/
224,DaGR2310,,uberdrivers,,1,,"It's call, fuck us. We don't care about you. Your expendable.",https://www.reddit.com/r/uberdrivers/comments/j8w6he/whats_at_stake/g8eup49/
225,kanendd718,Rate multiplier,uberdrivers,9.0,1,"I just dont get why people are not upping their rates out here? I mean were already flooded out with drivers, none of us are making any money in my market, im sure, even with prioritization of new drivers. Why don't these people just up their rates so we can make some money. Smh. So sad.",,https://www.reddit.com/r/uberdrivers/comments/ja1nl0/rate_multiplier/
226,DummyEastOakland,,uberdrivers,,1,,"Drivers that partnered with Uber before 2015 only pay 20% commission. It's always been like this. I only ""pay"" 20% to Lyft as well. I put ""pay"" in quotation marks because Lyft still gives riders upfront pricing.",https://www.reddit.com/r/uberdrivers/comments/ja1nl0/rate_multiplier/g8ngq8d/
227,freddyzuru,,uberdrivers,,1,,How are you paying only 20%?,https://www.reddit.com/r/uberdrivers/comments/ja1nl0/rate_multiplier/g8ng8ia/
228,DummyEastOakland,,uberdrivers,,1,,"Exactly, i must only do driver pass on the weekends from now on. I only pay 20% commission to Uber anyway.",https://www.reddit.com/r/uberdrivers/comments/ja1nl0/rate_multiplier/g8nfvuj/
229,freddyzuru,,uberdrivers,,1,,Btw when I was doing drive pass or if you’re doing drive pass I would ALWAYS keep multiplier on cause those $4 requests from 14 minutes away ate the shit outta my drive pass,https://www.reddit.com/r/uberdrivers/comments/ja1nl0/rate_multiplier/g8nfpxu/
230,DummyEastOakland,,uberdrivers,,1,,"It's very simple. Let's say we do the impossible and all agree to keep our rates at 2.0x. At some point someone is going to be a wise-guy and think to himself ""man, it's too slow, I'm going to set my rates at 1.9x and get pinged first."" This will continue to happen until we're back at base rates.",https://www.reddit.com/r/uberdrivers/comments/ja1nl0/rate_multiplier/g8nfiic/
231,DummyEastOakland,,uberdrivers,,1,,Uber brought back surge multiplier in California. Uber also let's California drivers set their own surge multiplier.,https://www.reddit.com/r/uberdrivers/comments/ja1nl0/rate_multiplier/g8nf021/
232,DummyEastOakland,,uberdrivers,,1,,"Im also in San Diego. I hate keeping my rates at base cause it kills off my driver pass with these shitty-ass requests i obviously decline. 

At the same time, even if i bump up my rates to 1.3x riders will decline my offer. I hate this surge dance we gotta do with riders. But yea, youre right. Weekend late nights are a different story.",https://www.reddit.com/r/uberdrivers/comments/ja1nl0/rate_multiplier/g8neubd/
233,mcmonopolist,,uberdrivers,,1,,"Pardon my ignorance, but how are you setting your own multiplier? In my market (Idaho) there is just a fixed $ amount per ride for surge pricing if demand gets high.",https://www.reddit.com/r/uberdrivers/comments/ja1nl0/rate_multiplier/g8n8io4/
234,freddyzuru,,uberdrivers,,1,,"My opinion is that you have to do it selectively. I’m in San Diego, and if I sit here with a 2.0 multiplier at 2 in the afternoon, nobody is gonna pay that much extra for a ride. Some people sit with it at 5.0, and I don’t think anyone is ever gonna be dumb enough to accept it when the app says the price is 1/5 of that.

It’s better to get 1.0x rides during the day than keep your multiplier at 2.0 or above and pray someone accepts it. 

Saturday and Friday nights are a different story though. When people are drunk and desperate for a ride, they tend not to really give a shit.",https://www.reddit.com/r/uberdrivers/comments/ja1nl0/rate_multiplier/g8n6bic/
235,Diganleqmemori,What has been the best conversation you’ve had with a passenger?,uberdrivers,4.0,1,"Assuming you’re the talking type, of course.  I very, very rarely speak unless a rider prompts it.  Most of the time, after initial pleasantries, I just about ignore them until we arrive wherever they are going.  Not that I’m anti social, I just know what it’s like being a passenger in with a overly chatty driver.  

I’d say deep conversations happen maybe 1 out of 20 rides, or so.  By “deep” I mean conversations that go beyond casual, for example, I had a 40 minute conversation with a guy about space travel, something I’m extremely interested in.  So was he, and it was a good one.  I was kind of sad to see him go.  

There was also a couple who told me a fascinating story about how they got rich (and lucky) in the stock market.  They were in their mid 30s, and were pretty much set for life.  Can’t say for sure if they were being truthful, but I did pick them up from one of the most expensive hotels in my city, and got a $25 cash tip on a $10 ride, so...maybe?  

Number 1 would have to be a fellow vet.  Turned out me and this guy were the same age, and were at the same duty station at the same time, only in different units.  That was way back in the 00s.  Back in ‘01, before 9/11, there was a brawl at the bowling alley on post.  Basically, on the weekends, scores of young soldiers would hit the bowling alley near the barracks.  There was a mixture of guys from different units, eg, infantry, artillery, cav, etc.  Long story short, we both were there, but didn’t know each other, although there’s a good chance we saw other.  Fast forward 19 years, and we’re in a car together.  Unbelievable.

I hate doing Uber, but it has its golden moments.",,https://www.reddit.com/r/uberdrivers/comments/ji513e/what_has_been_the_best_conversation_youve_had/
236,One-eyed-snake,,uberdrivers,,1,,"Do you school them about “island time” and how nobody there is in a hurry to do anything?  I lived in Hawaii for 5 years while in the navy and it took about a year for me to adjust to that. Around here people are “go go go” and there it’s “Ho bruddah, I’ll get to it when I get to it”",https://www.reddit.com/r/uberdrivers/comments/ji513e/what_has_been_the_best_conversation_youve_had/ga583xa/
237,Tokyo_Gore_Police,,uberdrivers,,1,,"I don’t really have any “best” conversations, but I do really enjoy when passengers are willing to engage in conversation rather than just sit there. Usually the ones I pick up are in a good mood since they’re on vacation and they love to talk about their plans for what they’re gonna get up to or what they’ve already done since they’ve been on island, and it makes it really easy for me to do my job. It’s probably why I’m nowhere near as jaded as so many other drivers. It also gives me a chance to slip in some “local knowledge” (basically pointing out something like a restaurant on my drive and telling them “only locals go there to eat”) they eat that sh*t up. And usually it results in me getting really good tips and a pleasant ride.",https://www.reddit.com/r/uberdrivers/comments/ji513e/what_has_been_the_best_conversation_youve_had/ga4vrb7/
238,[deleted],,uberdrivers,,1,,[removed],https://www.reddit.com/r/uberdrivers/comments/ji513e/what_has_been_the_best_conversation_youve_had/ga4t502/
239,stressedRAPHAEL,,uberdrivers,,2,,"I drive in the area of the college I graduated from earlier this year. Picked up a mom who was heading back to the station after spending the day with her son (parents can't go on campus thanks to covid). 

Online classes and social distancing really ruined the college experience for a lot of kids. She starts telling me about how her son had little to no guidance from his academic advisor, was already struggling in classes, hated the food, didnt feel comfortable wandering the local town, etc. When I told her I went to the same school she starts asking me what parts of her sons stories seemed like scared freshman problems and what were actual issues about the school/area.

I slowed down my driving so we could have a long-ish chat about the college, gave her advice to tell her son. All I knew about local areas he should visit or should stay away from, how to do well without relying on the schools crappy advisors/tutors, what food spots are guaranteed to give you food poison. Even gave her some social media accounts the student use to vent about campus issues, stuff the school tries to keep quiet.

She thanked me a dozen times, said she learned more about the college in our 20min drive than weeks of phone calls, websites, and tours. Im happy I was able to help her and her son, hope the kid does well this year.",https://www.reddit.com/r/uberdrivers/comments/ji513e/what_has_been_the_best_conversation_youve_had/ga4klsd/
240,Sallyman40,I really think we should be allowed to go back and change the original rating we gave a pax (RANT),uberdrivers,48.0,1,"Backstory:

Last night was the night before Halloween, in my town everyone still dresses up and what not. I had a dope costume and was receiving a ton of compliments.
Unfortunately I was driving in a student area, and most students don’t tip and I’m ok with that.

Fast forward and I pick up this older couple (40s) from downtown and drop them off at their luxurious home.

While driving them, they asked if I’ve been receiving a lot of tips because of my costume. I explain to them that I’ve been mostly driving students, so no.

Women: Wow students are just shitty people, that’s just sad. Babe make sure you tip our driver nicely.

Man: I’m doing that right now.

Me: thanks that really helps a lot.

Drop them off. No tip 16h later.

I know I know, how many people have come on here and ranted about an empty promised tip. But damn that couple was worse than the ‘students’ she said were shitty, at least they don’t promise empty tips.

I firmly believe we should be able to go back and change the ratings we originally gave them because no way in hell I would give them 5 stars based off that bs. If passengers can change our rating, why can’t we change theres?

I usually give a low rating to anyone who promises a tip during the ride, but the fact that the man said “I’m doing it right now” led me to believe he was actually tipping in the moment since his face was locked onto his smartphone.

Rant over, I’m done punching the air thank you.",,https://www.reddit.com/r/uberdrivers/comments/jlnptd/i_really_think_we_should_be_allowed_to_go_back/
241,VoidWalker4Lyfe,,uberdrivers,,1,,We used to be able to change our rating and they out a stop to it because drivers were literally doing just that lol.,https://www.reddit.com/r/uberdrivers/comments/jlnptd/i_really_think_we_should_be_allowed_to_go_back/gaxjksp/
242,BlackWhiteRedYellow,,uberdrivers,,1,,"No they don’t. Like yes you’re entitled to your “Uber bad” circlejerk, but this claim is baseless.",https://www.reddit.com/r/uberdrivers/comments/jlnptd/i_really_think_we_should_be_allowed_to_go_back/gauti01/
243,steveken,,uberdrivers,,1,,Oh I know,https://www.reddit.com/r/uberdrivers/comments/jlnptd/i_really_think_we_should_be_allowed_to_go_back/gaunvic/
244,LiterallyHitlerHolli,,uberdrivers,,1,,"Idk, I’ve found the opposite to be true. I tend to focus on the more affluent areas because they always tip me.",https://www.reddit.com/r/uberdrivers/comments/jlnptd/i_really_think_we_should_be_allowed_to_go_back/gaui7ny/
245,LiterallyHitlerHolli,,uberdrivers,,1,,"I wouldn’t put it past Uber. But FWIW, passengers have the option of changing their tip up to an hour after the trip or delivery.",https://www.reddit.com/r/uberdrivers/comments/jlnptd/i_really_think_we_should_be_allowed_to_go_back/gauhuyn/
