,author,title,subreddit,num_comments,score,selftext,body,permalink
0,magusat999,Angry funeral pax cancelled...,uberdrivers,12.0,1,"Im sorry. I just couldnt do it. I tried to be patient and compassionate, but after 4 calls, calling me all kinds of nasty names, referring to me in a racial slur, inciting an sngry mob that I could hear in the background - I had to cancel a woman at a funeral home. 

I understood she was sad, distraught, overcome with emotion. I would have sucked it up, but after the fourth call, cussing me out because she didnt get that I was u-turning to make pickup on the opposite side of the street where she was; accusing me of passing her by and continually asking me where I am... I couldnt let it slide anymore. I contemplated riding with this angry person and her mob, and I told her she needs to get another Uber - then cancelled. She was so busy cussing me, she probably didnt hear anything.

I dont think I ever want ti pick up or drop off funeral people. Its too much of an emotional burden.",,https://www.reddit.com/r/uberdrivers/comments/f4nifm/angry_funeral_pax_cancelled/
1,_LeggoMyEggo_,,uberdrivers,,1,,"""Where are you?""

[Cancel]",https://www.reddit.com/r/uberdrivers/comments/f4nifm/angry_funeral_pax_cancelled/fhw0wuo/
2,dragondreamcatcher,,uberdrivers,,2,,I mean if she didn't curse or use racial slur. I would still not pick her up if she was giving me attitude. A death in someone's family and/or friend is 0 excuse to take out your emotions on someone else.,https://www.reddit.com/r/uberdrivers/comments/f4nifm/angry_funeral_pax_cancelled/fhv2l16/
3,Bockwai,,uberdrivers,,1,,"The instant the first hint of attitude comes out of them you hang TF up, get to pin, wait out timer with doors locked, get no show and eject.  I dont care if shes coming from the funeral of her entire fam, show a little decency and humility in this life, or pay the no show fee and harass a more pathetic and desperate mule on ur next req.",https://www.reddit.com/r/uberdrivers/comments/f4nifm/angry_funeral_pax_cancelled/fht8xiv/
4,denrideshare,,uberdrivers,,1,,"1st cuss word, cancel. Your day will be better for it.",https://www.reddit.com/r/uberdrivers/comments/f4nifm/angry_funeral_pax_cancelled/fhsqo10/
5,jassumace,,uberdrivers,,1,,ahh i get it hope he had a new pax in nearby,https://www.reddit.com/r/uberdrivers/comments/f4nifm/angry_funeral_pax_cancelled/fhs355s/
6,sfxnyc,,uberdrivers,,1,,agree 100%,https://www.reddit.com/r/uberdrivers/comments/f4nifm/angry_funeral_pax_cancelled/fhrzjmw/
7,One-eyed-snake,,uberdrivers,,1,,He was smart and didn’t even pick her up,https://www.reddit.com/r/uberdrivers/comments/f4nifm/angry_funeral_pax_cancelled/fhrzhlw/
8,One-eyed-snake,,uberdrivers,,1,,My mother died 2 years ago and I didn’t go around calling people N words(or any other slur) and cursing at them.    There’s no valid excuse for shit like that,https://www.reddit.com/r/uberdrivers/comments/f4nifm/angry_funeral_pax_cancelled/fhrzflq/
9,jassumace,,uberdrivers,,1,,i would warn her that i need to focus on the driving and i cant hear her talking like that. if she continues i would stop the car and let her out.,https://www.reddit.com/r/uberdrivers/comments/f4nifm/angry_funeral_pax_cancelled/fhryyym/
10,sfxnyc,,uberdrivers,,1,,second that,https://www.reddit.com/r/uberdrivers/comments/f4nifm/angry_funeral_pax_cancelled/fhrylkh/
11,hydr0gen_,,uberdrivers,,1,,She's a cunt. Period. Stop sympathizing with people like this.,https://www.reddit.com/r/uberdrivers/comments/f4nifm/angry_funeral_pax_cancelled/fhrw9zb/
12,One-eyed-snake,,uberdrivers,,1,,A funeral doesn’t give her an excuse to act like that.  Fuck that bitch.,https://www.reddit.com/r/uberdrivers/comments/f4nifm/angry_funeral_pax_cancelled/fhrv3i6/
13,[deleted],"Sad day - got deactivated for ""fraud""",uberdrivers,28.0,0,[deleted],,https://www.reddit.com/r/uberdrivers/comments/g0e0s0/sad_day_got_deactivated_for_fraud/
14,whatabummerr,,uberdrivers,,0,,Suck a dick loser,https://www.reddit.com/r/uberdrivers/comments/g0e0s0/sad_day_got_deactivated_for_fraud/fnbxj6l/
15,ClverSwine,,uberdrivers,,1,,"$400, not 400$.",https://www.reddit.com/r/uberdrivers/comments/g0e0s0/sad_day_got_deactivated_for_fraud/fnbxhz2/
16,[deleted],,uberdrivers,,1,,[deleted],https://www.reddit.com/r/uberdrivers/comments/g0e0s0/sad_day_got_deactivated_for_fraud/fnbor4z/
17,ivytheblindhusky,,uberdrivers,,1,,What were you accused of doing? Being  late cuz of running multiple apps at thr ame time? Or did they make up some BS about you taking food,https://www.reddit.com/r/uberdrivers/comments/g0e0s0/sad_day_got_deactivated_for_fraud/fnbojws/
18,[deleted],,uberdrivers,,1,,[deleted],https://www.reddit.com/r/uberdrivers/comments/g0e0s0/sad_day_got_deactivated_for_fraud/fnbofqb/
19,[deleted],,uberdrivers,,0,,[deleted],https://www.reddit.com/r/uberdrivers/comments/g0e0s0/sad_day_got_deactivated_for_fraud/fnbodhg/
20,gagb1967,,uberdrivers,,3,,This is like getting tips how to quit doing drugs..... from your dealer....,https://www.reddit.com/r/uberdrivers/comments/g0e0s0/sad_day_got_deactivated_for_fraud/fnb3pyx/
21,[deleted],,uberdrivers,,1,,[deleted],https://www.reddit.com/r/uberdrivers/comments/g0e0s0/sad_day_got_deactivated_for_fraud/fnazdfb/
22,ivytheblindhusky,,uberdrivers,,1,,"so what exactly happened that got you deactivated? 

just curious lol",https://www.reddit.com/r/uberdrivers/comments/g0e0s0/sad_day_got_deactivated_for_fraud/fnayop5/
23,bananax22,,uberdrivers,,-2,,I totally effed one yesterday (accidentally accepted 2 orders in the totally opposite direction) and one order sat for 45 min. I remember this one because I though they were going to complain for sure. 10 dollar tip came through this morning 🤷,https://www.reddit.com/r/uberdrivers/comments/g0e0s0/sad_day_got_deactivated_for_fraud/fnau5of/
24,wasit-worthit,,uberdrivers,,2,,Imagine having to wait up to 30 minutes after your driver picks up your food. Smh.,https://www.reddit.com/r/uberdrivers/comments/g0e0s0/sad_day_got_deactivated_for_fraud/fnasqie/
25,bananax22,,uberdrivers,,1,,"Oh, I'm very serious. Just doing get deactivated and you are good lol (whatever that means)",https://www.reddit.com/r/uberdrivers/comments/g0e0s0/sad_day_got_deactivated_for_fraud/fnap5f4/
26,bananax22,,uberdrivers,,0,,I'm in the middle of the background check for them now. Hopefully I can give them a shot soon!,https://www.reddit.com/r/uberdrivers/comments/g0e0s0/sad_day_got_deactivated_for_fraud/fnaohyp/
27,bananax22,,uberdrivers,,-2,,"Realistically food didn't stay in my car for over 30 minutes, wasn't that bad I'd say.",https://www.reddit.com/r/uberdrivers/comments/g0e0s0/sad_day_got_deactivated_for_fraud/fnaoeix/
28,bananax22,,uberdrivers,,1,,Maybe I had customers call and complain to get free food saying they didn't get their food? Dunno really,https://www.reddit.com/r/uberdrivers/comments/g0e0s0/sad_day_got_deactivated_for_fraud/fnaob98/
29,bananax22,,uberdrivers,,1,,"400 on Saturday, then a little over 100 yesterday. Averaged 33 dollars an hour",https://www.reddit.com/r/uberdrivers/comments/g0e0s0/sad_day_got_deactivated_for_fraud/fnao5d6/
30,wasit-worthit,,uberdrivers,,6,,Curious how many meals were delivered at room temp as a result of your “system”.,https://www.reddit.com/r/uberdrivers/comments/g0e0s0/sad_day_got_deactivated_for_fraud/fnaijdd/
31,One-eyed-snake,,uberdrivers,,2,,Yeah.  They should say “this is what you shouldn’t do if you’re going to rob a bank”,https://www.reddit.com/r/uberdrivers/comments/g0e0s0/sad_day_got_deactivated_for_fraud/fnagag2/
32,whatabummerr,,uberdrivers,,2,,You ever see those documentaries of people in prison telling their life story on how they managed to rob banks and shit,https://www.reddit.com/r/uberdrivers/comments/g0e0s0/sad_day_got_deactivated_for_fraud/fnag0t7/
33,7aylor,,uberdrivers,,0,,Uber is the one who double dips with Uber pool.,https://www.reddit.com/r/uberdrivers/comments/g0e0s0/sad_day_got_deactivated_for_fraud/fnafq0u/
34,whatabummerr,,uberdrivers,,0,,"You meant 400$ over the weekend right, not just on Sunday?",https://www.reddit.com/r/uberdrivers/comments/g0e0s0/sad_day_got_deactivated_for_fraud/fnafhhd/
35,rallias,,uberdrivers,,2,,"I mean, fraud is the wrong term, but they did admit to termination-worthy activities.",https://www.reddit.com/r/uberdrivers/comments/g0e0s0/sad_day_got_deactivated_for_fraud/fnabto8/
36,rustybros2017,,uberdrivers,,0,,Not surprise i mean he has a pre-written message about leaving the food at the door and completing his order. Lol,https://www.reddit.com/r/uberdrivers/comments/g0e0s0/sad_day_got_deactivated_for_fraud/fn9y9vd/
37,One-eyed-snake,,uberdrivers,,5,,"I’m not sure whether to laugh or not. 

~”I got deactivated...here’s some tips to help you make bank”",https://www.reddit.com/r/uberdrivers/comments/g0e0s0/sad_day_got_deactivated_for_fraud/fn9v2jf/
38,ZoomZoom01,,uberdrivers,,0,,He was “double dipping”. So yeah it can be argued as fraud.,https://www.reddit.com/r/uberdrivers/comments/g0e0s0/sad_day_got_deactivated_for_fraud/fn9r4m1/
39,peds48,,uberdrivers,,1,,What was the deactivation for?,https://www.reddit.com/r/uberdrivers/comments/g0e0s0/sad_day_got_deactivated_for_fraud/fn9o50e/
40,wonderfulcarscent,,uberdrivers,,1,,Probably taking home food but not covering tracks.,https://www.reddit.com/r/uberdrivers/comments/g0e0s0/sad_day_got_deactivated_for_fraud/fn9l9fo/
41,[deleted],,uberdrivers,,1,,[removed],https://www.reddit.com/r/uberdrivers/comments/g0e0s0/sad_day_got_deactivated_for_fraud/fn9l4e2/
42,SunDevilElite42,,uberdrivers,,1,,Why did you get deactivated? What did you do for them to accuse you of fraud?,https://www.reddit.com/r/uberdrivers/comments/g0e0s0/sad_day_got_deactivated_for_fraud/fn9ja7n/
43,chandleryoung1215,,uberdrivers,,1,,What did they kick you off for? Having orders in the uber system and not working them?,https://www.reddit.com/r/uberdrivers/comments/g0e0s0/sad_day_got_deactivated_for_fraud/fn9aa2g/
44,lift_fit,,uberdrivers,,1,,"Eats has been dead for me. And no one tips on Eats. Grubhub? Everyone tips, and have been making like $80 for two hours of work most nights.",https://www.reddit.com/r/uberdrivers/comments/g0e0s0/sad_day_got_deactivated_for_fraud/fn9929b/
45,bananax22,,uberdrivers,,1,,Thanks man. I may be kicked off but hopefully I can help a little and you guys can still make bank! (Just don't get deactivated like me lol),https://www.reddit.com/r/uberdrivers/comments/g0e0s0/sad_day_got_deactivated_for_fraud/fn97ubp/
46,DeclutteringNewbie,,uberdrivers,,1,,"Thank you. 

I'm not working right now, but this post is quality!",https://www.reddit.com/r/uberdrivers/comments/g0e0s0/sad_day_got_deactivated_for_fraud/fn97q77/
47,DruidTrixxx,Ubereats newest payout came to my city - 2 week results.🤔,uberdrivers,12.0,1,"So a couple of weeks ago, ubereats latest(confusing) payout came to my city finally. I have read about it on threads. And everyone says they make less. Its been about 2 weeks now, &amp; I can see that they were all correct. Even though I still make way more than the average ubereater. I get really big tips regularly. I have had 100% rating with over 2000 deliveries. So I clearly am very good at delivering peoples food( not sure how people can mess that up). I deliver mainly graveyard hours. Sometimes ill start dinner. Mostly I start at 8 pm &amp; go till 4 am on weekends especially. Sometimes ill only do 2 or 3 hrs during the week. During the heart of the corona panic I have been pulling $40 - 50 per hr consistant. Before corona I was doing about 25-30$ . Now since the pay change im back down to $25 - 35 or 40 on good weekends. Its still corona time. And people are still tipping great. The pay per delivery lowered considerably. Like sometimes 2.0 boosts dont even add up to $1 a mile, which is sad. $1 a mile should be the minimum anyone should get paid to deliver. I dont know what no boost even comes out to? Maybe 50 cents a mile! My calculations are that about $25 per hr when its all said &amp; done is about minimum wage if you have a brand new vehicle. If you have an older vehicle you will spend more money on fixing it. Anything lower than $20 per hr &amp; you are making slave wages. Me personally, I will only do $25 at lowest. If I ever have long periods of $20 per hr ill stop. I dont see how they can lower the base pay anymore than it is already. I get $10, 20$ tips that make up for the base pay. If not it would be sad to be driving ubereats.",,https://www.reddit.com/r/uberdrivers/comments/hn1cvn/ubereats_newest_payout_came_to_my_city_2_week/
48,DruidTrixxx,,uberdrivers,,1,,The uber pay structure is as low as ever. Hopefully its run them off.,https://www.reddit.com/r/uberdrivers/comments/hn1cvn/ubereats_newest_payout_came_to_my_city_2_week/fxn5466/
49,chuckn0rrls,,uberdrivers,,1,,"It's common sense man. On the 25th the 600+ dollar a week unemployment ends which means the millions of drivers who are sitting home collecting it will be driving. Also, new people are signing up in droves because they got laid off, or never went back to work because they wanted to collect unemployment... Which ends on the 25th. That's what people in desperate situations do... They drive or deliver. On the 25th, there's going to be a lot more people in desperate situations, but you know what's not going up and might even get worse... Demand. Enjoy making money while it lasts... 2 more weeks.",https://www.reddit.com/r/uberdrivers/comments/hn1cvn/ubereats_newest_payout_came_to_my_city_2_week/fxmgpm2/
50,DruidTrixxx,,uberdrivers,,1,,How do you know this?,https://www.reddit.com/r/uberdrivers/comments/hn1cvn/ubereats_newest_payout_came_to_my_city_2_week/fxmbylw/
51,chuckn0rrls,,uberdrivers,,1,,Enjoy it while it lasts. July 25th the streets get saturated with old and new drivers.,https://www.reddit.com/r/uberdrivers/comments/hn1cvn/ubereats_newest_payout_came_to_my_city_2_week/fxm9k8e/
52,passingby2018,,uberdrivers,,1,,"Interesting, what you said pretty much is the same as what I've experienced during the day time, rush lunch/dinner hours. I ignore small payout orders which is 95% of eats, guess that's how UE works (rely on generous tipping AFTER delivery), which with Uber driving I completely distrust (90% don't tip if they don't tip upfront).

I don't work at night but what you said might be interesting to try for certain nights.",https://www.reddit.com/r/uberdrivers/comments/hn1cvn/ubereats_newest_payout_came_to_my_city_2_week/fxg8ede/
53,DruidTrixxx,,uberdrivers,,1,,Im lucky to be in a great spot. By my house people are ordering uber eats all night long. Jack in the box &amp; dennys 24 hrs. Midnight to 4 am is on fire by my house. No traffic. Drunk people tip me well. I used to do it in the day time when I first started. Before they showed the addresses. It sucked! Id get sent accross town. I only pulled $15 an hr usually. Once they began showing the addresses &amp; miles I cherry pick in my neighborhood. And I quit doing it in the day. Too much wait times &amp; traffic. Right now im only doing drive throughs because im not wearing a stupid mask. But its still nonstop with only drive throughs. People hate mcdonalds but I love them if its not packed. After 9 the mcdonalds arent bad. They close at 12 &amp; 1 on weekends. Its all in the tips. I can sometimes get 15$ for a little 1 mile mcdonalds run. I can get several of them in a row even at times. But I know that is not the norm. I dont want anyone ubering in my neighborhood. I want it all. I even kind of like it when they dont do high boosts because nobody will uber. I get double orders all night nonstop. No wait time. Im not even done delivering one when they are sending me another. I love it when its like that. When they do really high boosts thats when people want to do it. I notice its slower then.,https://www.reddit.com/r/uberdrivers/comments/hn1cvn/ubereats_newest_payout_came_to_my_city_2_week/fxcy458/
54,passingby2018,,uberdrivers,,1,,"Maybe it's my market, but I've noticed that in my market UE is cheap as fuck, usually $5 and it is difficult to do 3 delivery per hour in general.

90% of my accepted requests are from Door Dash, which includes partially the tip amount when showing the request, UE shows only without the tip so mostly it's a NO. I am not going to gamble on getting $5 tip for a $5 delivery (UE tips is 100% and by amount of 20-100% in my market).

I just can't imagine how you can pull in $30 or $40 regularly with UE, they are cheap as fuck, even with DoorDash I am doing $25 usually. That said I only accept UE of $10 and more, with tipping that do pays $40 and up (usually it's 20 minutes delivery and good tippers of $5-10) BUT I am talking about once a day (strangely usually lunch time) request.",https://www.reddit.com/r/uberdrivers/comments/hn1cvn/ubereats_newest_payout_came_to_my_city_2_week/fxcwqpn/
55,DruidTrixxx,,uberdrivers,,1,,$7.50 for 6 miles in LA &amp; you are losing money. Thats sad. And 2.0 boost! In LA it should be $2 a mile with no boost at all.,https://www.reddit.com/r/uberdrivers/comments/hn1cvn/ubereats_newest_payout_came_to_my_city_2_week/fx9cwbg/
56,Le0man,,uberdrivers,,2,,Some trips are even way more. First sunday after the changes i was on ventura blvd 2.0x boost. Got a trip for 6 miles but since i was right next to restuarant pay out was $7.50. No way before a 6 mile trip with 2x boost wouldn't pay me atleast $12-13,https://www.reddit.com/r/uberdrivers/comments/hn1cvn/ubereats_newest_payout_came_to_my_city_2_week/fx9bntq/
57,PinkPropaganda,,uberdrivers,,3,,Dara appreciates your contribution to his mansion.,https://www.reddit.com/r/uberdrivers/comments/hn1cvn/ubereats_newest_payout_came_to_my_city_2_week/fx924bu/
58,DruidTrixxx,,uberdrivers,,1,,Yup. Even $2 a trip lower on some that I do regularly. Same people same resteraunt. I noticed that.,https://www.reddit.com/r/uberdrivers/comments/hn1cvn/ubereats_newest_payout_came_to_my_city_2_week/fx8s25d/
59,Le0man,,uberdrivers,,2,,Fuck these new wages. Los angeles doesnt ever get huge surges and the boosts are lower then what they were,https://www.reddit.com/r/uberdrivers/comments/hn1cvn/ubereats_newest_payout_came_to_my_city_2_week/fx8qteu/
60,peds48,Is everyone having good promos in the their market?,uberdrivers,36.0,1,"How is everyone doing right now with promos? I just came back online again after being offline for like 3 months and have had the best week ever.  Worked 20 hours in 2 days and made $918, the sad thing is that this wont last long and we will be back to the peanuts Ubers pays out.  Share your good stories while they last.",,https://www.reddit.com/r/uberdrivers/comments/hpxzdc/is_everyone_having_good_promos_in_the_their_market/
61,gepgepgep,,uberdrivers,,1,,You don't need to.  Don't make enough.,https://www.reddit.com/r/uberdrivers/comments/hpxzdc/is_everyone_having_good_promos_in_the_their_market/fy7m6lg/
62,Threat1evelmidnight,,uberdrivers,,1,,Oh boy,https://www.reddit.com/r/uberdrivers/comments/hpxzdc/is_everyone_having_good_promos_in_the_their_market/fy7lt06/
63,peds48,,uberdrivers,,1,,"Yes, I am driving people but I am in New York where the ‘rona is some what contained at least from now.  We were the first state to get hammered by the ‘rona virus and lots of folks die but fortunately folks took it serious and mask wearing here is not controversial for the most part, no mask no ride that is my (and Uber’s) rule.",https://www.reddit.com/r/uberdrivers/comments/hpxzdc/is_everyone_having_good_promos_in_the_their_market/fxz2sbv/
64,FoxyKellxoxo,,uberdrivers,,1,,Yes so u pick up people,https://www.reddit.com/r/uberdrivers/comments/hpxzdc/is_everyone_having_good_promos_in_the_their_market/fxyp792/
65,FoxyKellxoxo,,uberdrivers,,1,,It was a typo I meant him not I,https://www.reddit.com/r/uberdrivers/comments/hpxzdc/is_everyone_having_good_promos_in_the_their_market/fxyp5ye/
66,peds48,,uberdrivers,,1,,"Not new driver, and this is for Uber X, you said you made that much in Uber Eats?

I drive on Long Island, NY",https://www.reddit.com/r/uberdrivers/comments/hpxzdc/is_everyone_having_good_promos_in_the_their_market/fxy9xii/
67,peds48,,uberdrivers,,1,,"20 for $55 is not bad, the one I had was 50 for $100 or 60 for $145.  Currently there is one for 50 for $130 Mon - Fri, which I am not doing.",https://www.reddit.com/r/uberdrivers/comments/hpxzdc/is_everyone_having_good_promos_in_the_their_market/fxy9sv9/
68,peds48,,uberdrivers,,1,,"NYC Suburbs (Long Island) and if course I had to pick up people, this is for Uber X",https://www.reddit.com/r/uberdrivers/comments/hpxzdc/is_everyone_having_good_promos_in_the_their_market/fxy9h2z/
69,gepgepgep,,uberdrivers,,1,,I work and don't report it,https://www.reddit.com/r/uberdrivers/comments/hpxzdc/is_everyone_having_good_promos_in_the_their_market/fxy5qf3/
70,wellington28,,uberdrivers,,1,,"No you can't in most places, if not all.  In my state I can earn $30 and then in deducts 1 to 1.   If you work and don't report it, you are committing fraud.    The only ""safe"" way to do both is to get paid under the table.   You have to be crazy to do both with an easy audit-able ""technology company""",https://www.reddit.com/r/uberdrivers/comments/hpxzdc/is_everyone_having_good_promos_in_the_their_market/fxxk5lk/
71,angerymonkey,,uberdrivers,,1,,You can do limited Ubering. You need to qualify for at least $1 in UI to get the $600 PUA payment.,https://www.reddit.com/r/uberdrivers/comments/hpxzdc/is_everyone_having_good_promos_in_the_their_market/fxwv8pf/
72,gepgepgep,,uberdrivers,,1,,"That makes no sense. You can still done Uber and collect that money.

Drivers are just scared.",https://www.reddit.com/r/uberdrivers/comments/hpxzdc/is_everyone_having_good_promos_in_the_their_market/fxwndpi/
73,bobfshr,,uberdrivers,,1,,"Currently Day 3 of 4, complete 20 trips $55 extra. Next week the best quest available is $85 for 60 trips (mon-fri). Market is Metro-Detroit (population: 4million)",https://www.reddit.com/r/uberdrivers/comments/hpxzdc/is_everyone_having_good_promos_in_the_their_market/fxwannz/
74,shakkyshawn,,uberdrivers,,1,,Same,https://www.reddit.com/r/uberdrivers/comments/hpxzdc/is_everyone_having_good_promos_in_the_their_market/fxwa6yo/
75,FoxyKellxoxo,,uberdrivers,,1,,What state and u had to be picking up people,https://www.reddit.com/r/uberdrivers/comments/hpxzdc/is_everyone_having_good_promos_in_the_their_market/fxw8ex5/
76,peds48,,uberdrivers,,1,,"Not bad at all for 23 hours, $45 an hour",https://www.reddit.com/r/uberdrivers/comments/hpxzdc/is_everyone_having_good_promos_in_the_their_market/fxw2zw4/
77,peds48,,uberdrivers,,1,,How many hours?,https://www.reddit.com/r/uberdrivers/comments/hpxzdc/is_everyone_having_good_promos_in_the_their_market/fxw2add/
78,sgtpepper2797,,uberdrivers,,1,,Driving is scary rn. Just doing eats its been ok. Promo last week. 10 trips $25 extra,https://www.reddit.com/r/uberdrivers/comments/hpxzdc/is_everyone_having_good_promos_in_the_their_market/fxvzfpd/
79,APettyJ,,uberdrivers,,2,,I forgot to mention the number of people who have permanently lost their former position and will be looking for a low barrier of entry job to fill in!,https://www.reddit.com/r/uberdrivers/comments/hpxzdc/is_everyone_having_good_promos_in_the_their_market/fxvxkvx/
80,Bockwai,,uberdrivers,,2,,I didn't say 19+ million Fuber mules coming off pua.  I said 19+ million unemployed total coming off pua and they will be looking to supplement their meager UI too.,https://www.reddit.com/r/uberdrivers/comments/hpxzdc/is_everyone_having_good_promos_in_the_their_market/fxvtc5l/
81,brynn24,,uberdrivers,,0,,Are the 19 mill all Uber drivers are do you know the exact number? It seems like SoCal especially needs more drivers because volume is up to the degree that people are asking why they are waiting for like 20-30 mins. It’ll balance out when drivers come back. I’m not sure I’ll see much a drop off since I drive everywhere in SoCal. At least I hope not.,https://www.reddit.com/r/uberdrivers/comments/hpxzdc/is_everyone_having_good_promos_in_the_their_market/fxvt3at/
82,Bockwai,,uberdrivers,,2,,"Not all who have been taking pua will, but think about the 19+ million unemployed who are also gonna be off pua come July 27.  They will more than make up for the ones who aren't gonna return when pua ends.",https://www.reddit.com/r/uberdrivers/comments/hpxzdc/is_everyone_having_good_promos_in_the_their_market/fxvsrm8/
83,brynn24,,uberdrivers,,1,,I’m working 8-9 hours. Only day I worked a 10 was Friday,https://www.reddit.com/r/uberdrivers/comments/hpxzdc/is_everyone_having_good_promos_in_the_their_market/fxvqn89/
84,brynn24,,uberdrivers,,1,,This week I’m just doing pickups.,https://www.reddit.com/r/uberdrivers/comments/hpxzdc/is_everyone_having_good_promos_in_the_their_market/fxvqm34/
85,FoxyKellxoxo,,uberdrivers,,1,,Plus I would have to work at least 10 to 12 hours .Or if your a new driver or new to uber u get bonuses.,https://www.reddit.com/r/uberdrivers/comments/hpxzdc/is_everyone_having_good_promos_in_the_their_market/fxvqg3l/
86,FoxyKellxoxo,,uberdrivers,,1,,Not just on uber eats and u must be doing both or just picking up people,https://www.reddit.com/r/uberdrivers/comments/hpxzdc/is_everyone_having_good_promos_in_the_their_market/fxvqe03/
87,brynn24,,uberdrivers,,1,,"Im in Southern California and I made $1,700 this week",https://www.reddit.com/r/uberdrivers/comments/hpxzdc/is_everyone_having_good_promos_in_the_their_market/fxvqbfx/
88,brynn24,,uberdrivers,,0,,"I don’t disagree with your entire assessment but it also depends on the market. Even with drivers going back to the workforce in a few weeks, the SoCal market is still a money hub. Even with a few sectors that are partially closed. Also there is no guarantee that all will return back to driving during the pandemic.",https://www.reddit.com/r/uberdrivers/comments/hpxzdc/is_everyone_having_good_promos_in_the_their_market/fxvq9at/
