,author,title,subreddit,num_comments,score,selftext,body,permalink
246,SalvoWolf,,uberdrivers,,1,,"See I have the perfect counter to that... when they say ""Oh I will tip you this for X"" I just say, ""Don't worry about it, only worry about tip if I get you there safely.... (Need to pause) and preferable not on fire."" I say it with a smile (they can hear the smile in the voice) and then I start humming Psycho Killer by the Talking Heads some time after we start while just going a smidge faster and taking turns a smidge tighter.  


Not got a 1 star for that yet (which is surprising because I am very much so an asshole...) and it makes them a little more thankful to get to their destination.",https://www.reddit.com/r/uberdrivers/comments/jlnptd/i_really_think_we_should_be_allowed_to_go_back/gau2d7n/
247,jazzmoney,,uberdrivers,,1,,"From s4 of Fargo:

“I just stole from that man. Forget it weren’t his money. Just seeing that scratch, he made a future for himself, and I took that from him.”",https://www.reddit.com/r/uberdrivers/comments/jlnptd/i_really_think_we_should_be_allowed_to_go_back/gatavxc/
248,TheUltimateSalesman,,uberdrivers,,1,,"What, you think Uber passes the tip along? LOL  They keep upit",https://www.reddit.com/r/uberdrivers/comments/jlnptd/i_really_think_we_should_be_allowed_to_go_back/gass7qd/
249,No-Sand-4357,,uberdrivers,,1,,"True. I picked up a guy who sent me to the wrong address by mistake, so I called him and gave me his new location. Drove him to the drop off and told me he would tip me, but didn't give me any tip. What a shitty person.",https://www.reddit.com/r/uberdrivers/comments/jlnptd/i_really_think_we_should_be_allowed_to_go_back/gasln0e/
250,NonchalantSavant,,uberdrivers,,1,,"By the way, I have had several different passengers tell me that occasionally the app doesn’t provide the tipping option. I don’t know what’s up with that.",https://www.reddit.com/r/uberdrivers/comments/jlnptd/i_really_think_we_should_be_allowed_to_go_back/gasjg65/
251,brady2gronk,,uberdrivers,,1,,"The blatant LIE would bother me too.   

Do you drive in that town regularly?  Maybe you'll get that couple again and can bring it up.   I think most people lie figuring they will never see that driver again.    What they don't plan on is you know their home address.    I've been tempted to put notes in mailboxes of people who promise to tip and then don't.",https://www.reddit.com/r/uberdrivers/comments/jlnptd/i_really_think_we_should_be_allowed_to_go_back/gasgzgp/
252,surfANDmusic,,uberdrivers,,1,,"You’re missing the point. It’s not about whether they tipped or not, it’s that they LIED about tipping. If they had just kept their mouth shut and not said that magnacious phrase we are all familiar with, “I’ll tip in the app”, then it would’ve been alright.",https://www.reddit.com/r/uberdrivers/comments/jlnptd/i_really_think_we_should_be_allowed_to_go_back/gase8b3/
253,Gareth666,,uberdrivers,,1,,hmmm in Australia we can change rating of a pax via the website.,https://www.reddit.com/r/uberdrivers/comments/jlnptd/i_really_think_we_should_be_allowed_to_go_back/gas07xi/
254,connnor4real,,uberdrivers,,1,,"If it bothers you this much, have you thought about getting a different job? Maybe one that’s not in customer service?",https://www.reddit.com/r/uberdrivers/comments/jlnptd/i_really_think_we_should_be_allowed_to_go_back/garqpor/
255,Shaaadyx,,uberdrivers,,1,,You know you don’t have to rate them after the trip right? Just ignore the rating screen until your next trip comes in.,https://www.reddit.com/r/uberdrivers/comments/jlnptd/i_really_think_we_should_be_allowed_to_go_back/garh154/
256,compuryan,,uberdrivers,,1,,We used to be able to do this. They took it away about 3-4 years ago.,https://www.reddit.com/r/uberdrivers/comments/jlnptd/i_really_think_we_should_be_allowed_to_go_back/gargwso/
257,steveken,,uberdrivers,,1,,I completely agree with you. I sat and watched many tip me but I never got them. I firmly believe those fucks are stealing our tips. That's why I quit.,https://www.reddit.com/r/uberdrivers/comments/jlnptd/i_really_think_we_should_be_allowed_to_go_back/gargphq/
258,Sallyman40,,uberdrivers,,1,,"Footplayer. Had the helmet, Jersey, swag, gloves etc",https://www.reddit.com/r/uberdrivers/comments/jlnptd/i_really_think_we_should_be_allowed_to_go_back/garc5gs/
259,obscuriall,,uberdrivers,,1,,"Unrelated, but what was your costume?",https://www.reddit.com/r/uberdrivers/comments/jlnptd/i_really_think_we_should_be_allowed_to_go_back/gar74cs/
260,Ulimarmel,,uberdrivers,,1,,"Uber doesn’t care about its drivers, plain and simple, they have a countdown for the day they tell all of us to fuck off so don’t be surprised when they repeatedly screw you over.",https://www.reddit.com/r/uberdrivers/comments/jlnptd/i_really_think_we_should_be_allowed_to_go_back/gar56g6/
261,Chanoch,,uberdrivers,,1,,"Up until the pandemic I drove Uber for 5 years. I would rate every single pax one star who gave the ""tip you in the app"" line.
Tbh after a few years, I'd rate everyone one star if they took more than 2 minutes to show up once I arrived.

I mean, you get a notification when we are two minutes away. Then another when we arrive and YET ANOTHER if we use the ""I have arrived"" text.",https://www.reddit.com/r/uberdrivers/comments/jlnptd/i_really_think_we_should_be_allowed_to_go_back/gaqzpg4/
262,Sallyman40,,uberdrivers,,1,,Almost 2000 trips in London Ontario. This has happened to me about 8+ times now,https://www.reddit.com/r/uberdrivers/comments/jlnptd/i_really_think_we_should_be_allowed_to_go_back/gaqrv1c/
263,pakrat1967,,uberdrivers,,1,,It's also possible when she saw her rating drop that she felt a little guilty for something she did or said.  It's happened to me a few times.  I rate a PAX less than 5* for something they did or said.  I fully expect to see my rating drop due to retaliation.  Instead I'm pleasantly surprised to see they tipped.  Not all PAX are scum.  Some are actually decent people.,https://www.reddit.com/r/uberdrivers/comments/jlnptd/i_really_think_we_should_be_allowed_to_go_back/gaqoe8a/
264,siglawoo,,uberdrivers,,1,,3 years and almost 5k rides here. And never once have someone told me that they would tip me on the app and never did. They always tipped if they mentioned it. So i dont understand where do you guys run into so many hypocrites.. i love my toronto even more now,https://www.reddit.com/r/uberdrivers/comments/jlnptd/i_really_think_we_should_be_allowed_to_go_back/gaqmkvi/
265,frapawhack,,uberdrivers,,1,,it's a tip drought. Act accordingly,https://www.reddit.com/r/uberdrivers/comments/jlnptd/i_really_think_we_should_be_allowed_to_go_back/gaqlq6o/
266,jazzmoney,,uberdrivers,,1,,"Okay, I think you guys are being petty. 

Rate the trip for what it was. No issues, pax was polite and clean, wasn’t abusive, wasn’t late, whatever, you 5 star them. 

If they’re a shitty pax but they give you cash tip, so you 5 star them?

If we are to start rating based on tip, then no one will know if the pax rating is based on bad experience.",https://www.reddit.com/r/uberdrivers/comments/jlnptd/i_really_think_we_should_be_allowed_to_go_back/gaqjmbl/
267,Sallyman40,,uberdrivers,,1,,"That’s fine, but don’t promise one and act like your gonna tip me",https://www.reddit.com/r/uberdrivers/comments/jlnptd/i_really_think_we_should_be_allowed_to_go_back/gaqik20/
268,Sallyman40,,uberdrivers,,1,,"I’m in Canada, and town I’m in, we haven’t seen a surge since early September. So students are paying normal prices",https://www.reddit.com/r/uberdrivers/comments/jlnptd/i_really_think_we_should_be_allowed_to_go_back/gaqiix7/
269,expizzaman,,uberdrivers,,1,,"I know it's not popular but I think Uber just steals tips. How would anyone know?  I had one person show me they were tipping and it didn't come through. Called support three days later and magically about 5  tips, including the one I saw, were credited to the account.",https://www.reddit.com/r/uberdrivers/comments/jlnptd/i_really_think_we_should_be_allowed_to_go_back/gaqgbcf/
270,king_m1k3,,uberdrivers,,1,,"&gt; drop them off at their luxurious home.

That's your first hint. Rich people didn't get that way by giving all their Uber drivers big tips.",https://www.reddit.com/r/uberdrivers/comments/jlnptd/i_really_think_we_should_be_allowed_to_go_back/gaqfe3n/
271,hessercan,,uberdrivers,,1,,I hear you. College kids are the worst tippers. But then again I wouldn’t tip either if I was being charged $40 for a $15 ride. Surge has become the new tipping system. How sad is that?,https://www.reddit.com/r/uberdrivers/comments/jlnptd/i_really_think_we_should_be_allowed_to_go_back/gaqexla/
272,Sallyman40,,uberdrivers,,2,,"Fair enough, my way of brushing it off is ranting. Works for me",https://www.reddit.com/r/uberdrivers/comments/jlnptd/i_really_think_we_should_be_allowed_to_go_back/gaqen83/
273,hessercan,,uberdrivers,,1,,"If I got a tip every time someone promised one, my income would be double. I expect an empty promise so I’m not disappointed. Yet every rider in my car gets 5 stars regardless if we have a problem or not, because I expect the same in return. If you get a low rating in my car, cops are involved. But then again this is a college town and i driver overnight. Drunk kids are just more fun, but that’s just me. Got the puke bags ready to go. 😂 I get random 1 stars from time to time for no reason, but you just brush it off an move on, because 1 out of 500 ain’t that bad.",https://www.reddit.com/r/uberdrivers/comments/jlnptd/i_really_think_we_should_be_allowed_to_go_back/gaqde1e/
274,Tokyo_Gore_Police,,uberdrivers,,1,,"I follow that same tactic regarding any questions I get. Like if a pax asks me “what’s the worst/most annoying thing about Uber?,” I always find a way to soften and spin it. I give a little bit of honesty that it’s not perfect, but I don’t use it as an opportunity to rail on Uber and act like I hate doing it. That doesn’t make anyone feel comfortable.",https://www.reddit.com/r/uberdrivers/comments/jlnptd/i_really_think_we_should_be_allowed_to_go_back/gaqcmm5/
275,Tokyo_Gore_Police,,uberdrivers,,1,,"I think more importantly PAX shouldn’t be able to rate drivers after like 5 minutes after their ride is completed. To many drivers (myself included) get retaliatory one star ratings from PAX after we file a legitimate claim against them (like dirtying our car). Of course they’re going to be petty and give us a one star after they get the bill even though they were the one that caused the problem. 

Pax can take a ride, not look at the app for days, and the next time they open the app it will be like “how was the ride with X?” And that’s what opens the liability. Because we can hit them with a legitimate charge and they still have the ability to rate us after the fact.",https://www.reddit.com/r/uberdrivers/comments/jlnptd/i_really_think_we_should_be_allowed_to_go_back/gaqcfba/
276,ommi9,,uberdrivers,,1,,You can change rating of pax thru the support tab. Or tap the question. Mark button next to the stats that says last trip,https://www.reddit.com/r/uberdrivers/comments/jlnptd/i_really_think_we_should_be_allowed_to_go_back/gaqc65u/
277,sharararara,,uberdrivers,,1,,"I mean, I make a practice of NEVER saying anything bad about tips. 

If students arent tipping and you want to be honest, say something like ""they give what they can, I onow school is hard."" Even if it sounds like a cop-out thing to say, it makes you sound less bitter while insinuating tips havent been great, and you seem grateful. 

It just tends to throw people off when they know you're  ""working for money"" lol",https://www.reddit.com/r/uberdrivers/comments/jlnptd/i_really_think_we_should_be_allowed_to_go_back/gaqa9jv/
278,StoicApathyGaming,,uberdrivers,,1,,"Lol the universal code for not tipping, is “I’ll tip in the app”.

Adapt. Adjust. Overcome.",https://www.reddit.com/r/uberdrivers/comments/jlnptd/i_really_think_we_should_be_allowed_to_go_back/gaq9nax/
279,yes_im_new_here,,uberdrivers,,1,,"I don't think anyone's mentioned this yet, but tips can take many hours, even days sometimes to show up in your earnings. I don't know why, but it has been brought up many times by other drivers in this sub. I had a Lyft tip come thru 3 weeks after a ride once.",https://www.reddit.com/r/uberdrivers/comments/jlnptd/i_really_think_we_should_be_allowed_to_go_back/gaq93p2/
280,lavasca,,uberdrivers,,1,,Understood. He lied when he didn’t need to.,https://www.reddit.com/r/uberdrivers/comments/jlnptd/i_really_think_we_should_be_allowed_to_go_back/gaq8f71/
281,NewPhillyDriver,,uberdrivers,,1,,Not once,https://www.reddit.com/r/uberdrivers/comments/jlnptd/i_really_think_we_should_be_allowed_to_go_back/gaq80yj/
282,noothersinvolved,,uberdrivers,,1,,"Agreed. But my reason is different.     
I had a woman that seemed insistent on talking about COVID and the lockdown. How she knew what was best because she was a nurse. Not an epidemiologist, a nurse.     
She was quite pushy and I felt that she was looking for a reason to give me a bad rating. So I gave her three stars. One of the only people I’ve not given five stars to.   
Ten minutes later she tipped me almost as much as the cost of the journey. Which, where I live, is unheard of. Tips themselves are rare here in the UK.     
I just think she didn’t have good social skills and I penalised her for that...",https://www.reddit.com/r/uberdrivers/comments/jlnptd/i_really_think_we_should_be_allowed_to_go_back/gaq7ynk/
283,Sallyman40,,uberdrivers,,2,,"Thank you, again not tipping is ok. We don’t think your a bad person if you don’t tip. Just don’t promise a tip and become a ghost",https://www.reddit.com/r/uberdrivers/comments/jlnptd/i_really_think_we_should_be_allowed_to_go_back/gaq7yge/
284,lavasca,,uberdrivers,,1,,"That blows. I lurk here to learn to be a better pax. I try to make sure I have cash for tips. If I don’t, I try to show the driver, while stopped, that I am tipping.",https://www.reddit.com/r/uberdrivers/comments/jlnptd/i_really_think_we_should_be_allowed_to_go_back/gaq6wu5/
285,TigerBearGargoyle,,uberdrivers,,1,,"FWIW you have 24 hours to rate pax with Lyft, doesn’t seem to break anything",https://www.reddit.com/r/uberdrivers/comments/jlnptd/i_really_think_we_should_be_allowed_to_go_back/gaq6mug/
286,PlexFD,,uberdrivers,,4,,I've noticed the ones who say 'We'll take care of you on the app.' are the ones who NEVER tip... Basically the same thing,https://www.reddit.com/r/uberdrivers/comments/jlnptd/i_really_think_we_should_be_allowed_to_go_back/gaq5amj/
287,Sallyman40,,uberdrivers,,2,,"I would just go back and 1 star the people who promised a tip. 

But I see what your saying. Maybe they can limit how many people you can go back and 1 star per week or something. Like 2 per week.",https://www.reddit.com/r/uberdrivers/comments/jlnptd/i_really_think_we_should_be_allowed_to_go_back/gaq4jrw/
288,WilliamJDL,,uberdrivers,,1,,"This will never happen in a million years, because then you could go back and retroactively 1 star all the pax who didn't tip, and Uber won't have that.",https://www.reddit.com/r/uberdrivers/comments/jlnptd/i_really_think_we_should_be_allowed_to_go_back/gaq28vx/
289,NC4Life078,Went to order some food and when I saw the price I said; Nope- and the sad thing is that if we were to deliver this same item we’d be lucky to make $10 out of it.,uberdrivers,0.0,1,,,https://www.reddit.com/r/uberdrivers/comments/jt686b/went_to_order_some_food_and_when_i_saw_the_price/
290,AcesAdventures,How sad that the best night of the yr is DEAD,uberdrivers,14.0,1,"Thanksgiving eve last year made almost 600 in one night, no surge no demand at all this year, sucks :(, Happy Turkey Day everyone",,https://www.reddit.com/r/uberdrivers/comments/k14kmr/how_sad_that_the_best_night_of_the_yr_is_dead/
291,Shot_Mousse_7006,,uberdrivers,,1,,600? What city is this? The most i ever made was 300 working full day and night till 3 am,https://www.reddit.com/r/uberdrivers/comments/k14kmr/how_sad_that_the_best_night_of_the_yr_is_dead/gebume4/
292,Aired_,,uberdrivers,,1,,"Sucked here too, logged 6 hours yesterday 3 at lunch 3 at dinner had 4 fairs, 3 of which were worth taking. (dayton, ohio)",https://www.reddit.com/r/uberdrivers/comments/k14kmr/how_sad_that_the_best_night_of_the_yr_is_dead/gdo9fev/
293,angerymonkey,,uberdrivers,,1,,"2018 was used because it's a typical year. This year is supposed to be atypical because of corona. You seem to have a problem with basic math.

I'm talking about the US. Not Europe.",https://www.reddit.com/r/uberdrivers/comments/k14kmr/how_sad_that_the_best_night_of_the_yr_is_dead/gdnha0u/
294,MrVolcanoes22,,uberdrivers,,1,,"2018 numbers for deaths of all causes was ~2.8 million. Why you picked 2018 specifically, I've no clue. Exess deaths take into account the average of the past 5 years. The same CDC you mentioned wrote this ""Overall, an estimated 299,028 excess deaths occurred from late January through October 3, 2020, with 198,081 (66%) excess deaths attributed to COVID-19."" 

I can only assume the 30k you mentioned is the same stupid spin conspiracy nuts put on CDC data about comorbidities that never said COVID only caused 7% or whatever of counted deaths, but that the other 93% of deaths had associated complications like *lung failure* or *heart failure *. In fact the CDC even went out of its way to count people that literally didn't die of COVID and its a tiny fraction of people out of the hundreds of thousands dead and perhaps millions more with lasting impacts on their health 

The only way the numbers would be 30k above an average year is if somehow those 300k people would have died at some point this very year, something other papers have demonstrated to be patently false as far back as May. Life expentancy per a University of Glasgow study dropped 10 YEARS, not months. 

To bring this back to Uber. Its a pain in the ass that we have to deal with the economic setbacks but assholes spreading the disease through their selfishness and willful ignorance are a huge part of why this thing is still around.",https://www.reddit.com/r/uberdrivers/comments/k14kmr/how_sad_that_the_best_night_of_the_yr_is_dead/gdnazd3/
295,angerymonkey,,uberdrivers,,1,,What matters is all-cause mortality. Those numbers come straight from the CDC. Can't you read?,https://www.reddit.com/r/uberdrivers/comments/k14kmr/how_sad_that_the_best_night_of_the_yr_is_dead/gdna3om/
296,MrVolcanoes22,,uberdrivers,,1,,Excess mortality between March and August was already 300k in the US where the fuck do yall get these nonsense numbers from?,https://www.reddit.com/r/uberdrivers/comments/k14kmr/how_sad_that_the_best_night_of_the_yr_is_dead/gdn9x27/
297,angerymonkey,,uberdrivers,,1,,A pandemic yet the all-cause mortality numbers will likely be within 30k of 2018's numbers. That's less than 2 extra people per day per state. I'm guessing that's lower than the suicides and drug overdoses caused by the lockdowns.,https://www.reddit.com/r/uberdrivers/comments/k14kmr/how_sad_that_the_best_night_of_the_yr_is_dead/gdmx4rg/
298,DisBStupid,,uberdrivers,,1,,Informing you that there’s a major difference between last year and today is giving you a cocky attitude?,https://www.reddit.com/r/uberdrivers/comments/k14kmr/how_sad_that_the_best_night_of_the_yr_is_dead/gdmn1ci/
299,One-eyed-snake,,uberdrivers,,1,,Dude.  Thanksgiving has been cancelled.  Didn’t you get the memo?  That bitch Rona is the one you have a beef with,https://www.reddit.com/r/uberdrivers/comments/k14kmr/how_sad_that_the_best_night_of_the_yr_is_dead/gdma8sy/
300,EXTRAsharpcheddar,,uberdrivers,,3,,"&gt;AcesAdventures
4m
It’s called I still have bills to pay? Did i ask for your cocky ass response

Yes",https://www.reddit.com/r/uberdrivers/comments/k14kmr/how_sad_that_the_best_night_of_the_yr_is_dead/gdm39qx/
301,tallblonde402,,uberdrivers,,8,,"Do Uber eats, Postmates.. And Yes when you post on Reddit your asking for responses",https://www.reddit.com/r/uberdrivers/comments/k14kmr/how_sad_that_the_best_night_of_the_yr_is_dead/gdm2xay/
302,AcesAdventures,,uberdrivers,,-2,,It’s called I still have bills to pay? Did i ask for your cocky ass response,https://www.reddit.com/r/uberdrivers/comments/k14kmr/how_sad_that_the_best_night_of_the_yr_is_dead/gdm2t7k/
303,tallblonde402,,uberdrivers,,2,,It's called a pandemic. It's good people aren't going out,https://www.reddit.com/r/uberdrivers/comments/k14kmr/how_sad_that_the_best_night_of_the_yr_is_dead/gdm2qwk/
304,Bockwai,,uberdrivers,,0,,Get out and #win.  Make Fuber need you more than you need them.  Then you don't care about how much they wanna try and exploit you.,https://www.reddit.com/r/uberdrivers/comments/k14kmr/how_sad_that_the_best_night_of_the_yr_is_dead/gdlyict/
305,StoicApathyGaming,Idk how Lyft drivers survive with their app,uberdrivers,42.0,1,"Those sad humans.. I resigned up for Lyft yesterday, and got 2 trips in among doing Uber all night. These mofos and their algorithm. The driver has no say so in if they want to accept a trip or not after they start their first ride. The app as your closing to finish the first ride says, “adding rider to queue”. And it could be a ride 3 blocks away and you have no say. You have to do it, or you’re penalized with acceptance or cancellation rates.

Thankful that Uber has the decency to let us pick our poison at least. And no longer penalizes drivers for acceptance ratings.",,https://www.reddit.com/r/uberdrivers/comments/kcagg2/idk_how_lyft_drivers_survive_with_their_app/
306,StoicApathyGaming,,uberdrivers,,2,,"The fact that you’re forced to accept a 3 minute trip for $2.50 is terrible. And you don’t know til you start the ride. With Lyft, I can see why people wanted prop 22 to fail. But Uber I know what I’m getting before I even go to a rider. That makes a world of difference to know I’m being compensated how I want before a trip.",https://www.reddit.com/r/uberdrivers/comments/kcagg2/idk_how_lyft_drivers_survive_with_their_app/gfym9nu/
307,Domkatter1,,uberdrivers,,1,,Lmao I said the same!!! That’s why I never use Lyft anymore. Plus you don’t make enough money. Uber you make a lot more and can set your rates.,https://www.reddit.com/r/uberdrivers/comments/kcagg2/idk_how_lyft_drivers_survive_with_their_app/gfylv5n/
308,duckman963,,uberdrivers,,1,,Riots*,https://www.reddit.com/r/uberdrivers/comments/kcagg2/idk_how_lyft_drivers_survive_with_their_app/gftlhyl/
309,bms0430,,uberdrivers,,1,,Still the wrong directions when I tried that.  I just switched to Uber.,https://www.reddit.com/r/uberdrivers/comments/kcagg2/idk_how_lyft_drivers_survive_with_their_app/gfrj1qj/
310,rook_of_approval,,uberdrivers,,1,,You have to drop a pin instead of typing in the address. This happens a lot on both apps.,https://www.reddit.com/r/uberdrivers/comments/kcagg2/idk_how_lyft_drivers_survive_with_their_app/gfrg8wi/
311,rook_of_approval,,uberdrivers,,1,,At dropoff you look up location of next pickup before you mark it on the app. Yeah it's a bit annoying.,https://www.reddit.com/r/uberdrivers/comments/kcagg2/idk_how_lyft_drivers_survive_with_their_app/gfrg4o5/
312,bms0430,,uberdrivers,,1,,"Lyft's directions are awful.  I live in a high-rise building on the main street of a 20,000 person city, so not a huge spot but should be easy enough to find.  Lyft has wrong directions to that location, telling people to turn left instead of continuing to my building.  And they have wrong directions to my job.",https://www.reddit.com/r/uberdrivers/comments/kcagg2/idk_how_lyft_drivers_survive_with_their_app/gfr8mje/
313,gagb1967,,uberdrivers,,1,,"Depends on the market.
In my market, they pay 0.08 cents per minute (4.85 hour) and 0.53 a mile. To top it off, pick ups are average 6 miles away. You make if you are lucky, 60 cents a mile, so to make 200 dollars, you need to drive 350 to 400 miles a day.....",https://www.reddit.com/r/uberdrivers/comments/kcagg2/idk_how_lyft_drivers_survive_with_their_app/gfqvks9/
314,ifeelthesame4u,,uberdrivers,,1,,Is that legal there ? In Seattle cops are cracking down those people on the bad news areas  . I haven’t see them around my neighborhood anyway .,https://www.reddit.com/r/uberdrivers/comments/kcagg2/idk_how_lyft_drivers_survive_with_their_app/gfqvfp8/
315,hsimpkins82,,uberdrivers,,1,,"Yea most apartment are under 2,000 and my apartment is 900 month I live 15 min west of Dallas. I just drive to downtown Dallas and turn app on. If I turn it on at my house it takes me to Fort Worth and not much money out there.

We do have some protest here, but Texas don’t put up with that shit and will shut it down.

More than anything texas has a problems with street racers taking over streets and doing donuts in middle of intersections and they placing speed bumps and barriers at certain places to stop them.

Had a few pax in car at 2am that got to get to see street races at 2am in morning and crouch rocket 🚀 flying by. 😂",https://www.reddit.com/r/uberdrivers/comments/kcagg2/idk_how_lyft_drivers_survive_with_their_app/gfqowgj/
316,ifeelthesame4u,,uberdrivers,,1,,🤣. 39 for me is normal as long is not snowing. Where I live most restaurants and bars are closed except some casinos . But the money is always out there if you are patient and your work overnight,https://www.reddit.com/r/uberdrivers/comments/kcagg2/idk_how_lyft_drivers_survive_with_their_app/gfqnycy/
317,ifeelthesame4u,,uberdrivers,,1,,Good to know . And the housing there is inexpensive I guess . So the downtown is working normal ? My area is Seattle and the downtown is fucked up because BLM protests .,https://www.reddit.com/r/uberdrivers/comments/kcagg2/idk_how_lyft_drivers_survive_with_their_app/gfqnu8s/
